,path,source,url,date,title,subtitle,author,rubrics,tags,genre
0,/indicator_clear_text/2017_01_04_chem-klimatologam-zapomnilsya-2016-god_,indicator.ru,https://indicator.ru/article/2017/01/04/chem-klimatologam-zapomnilsya-2016-god/,2017_01_04,"Плюсы, минусы, коралловые рифы",Чем климатологам запомнился 2016 год,Дарья Сапрыкина,Науки о Земле,,Статьи
0,/indicator_clear_text/2017_05_22_patent-na-pianolu_,indicator.ru,https://indicator.ru/article/2017/05/22/patent-na-pianolu/,2017_05_22,История науки: окончательный рассказ о механическом пианино,117 лет назад был выдан патент на пианолу,,Технические науки,,Статьи
0,/indicator_clear_text/2016_09_30_boeing_,indicator.ru,https://indicator.ru/article/2016/09/30/boeing/,2016_09_30,История науки: мечта в металлическом корпусе,135 лет назад родился основатель фирмы «Боинг»,Алёна Манузина,Технические науки,,Статьи
0,/indicator_clear_text/2017_08_09_bibliometriya-ot-majkla-kurca_,indicator.ru,https://indicator.ru/article/2017/08/09/bibliometriya-ot-majkla-kurca/,2017_08_09,Наука подобрать: помогает ли наукометрия принимать кадровые решения,"Астроном Майкл Курц о том, как использовать наукометрические показатели для подбора научных сотрудников",,Астрономия,,Статьи
0,/indicator_clear_text/2017_03_18_tri-v-odnom-lekarstva-dnk-i-magnitorecepciya-video_,indicator.ru,https://indicator.ru/article/2017/03/18/tri-v-odnom-lekarstva-dnk-i-magnitorecepciya-video/,2017_03_18,"Три в одном: лекарства, ДНК и магниторецепция. Видео",Трансляция биологического лектория Indicator.Ru и Архэ,,Биология,,Статьи
0,/indicator_clear_text/2016_09_29_uchenye-iz-rossii-sozdayut-analgetiki-na-baze-yada-mollyuska-ubijcy_,indicator.ru,https://indicator.ru/article/2016/09/29/uchenye-iz-rossii-sozdayut-analgetiki-na-baze-yada-mollyuska-ubijcy/,2016_09_29,"Ученые из России создают анальгетики на базе яда ""моллюска-убийцы""","Изучен яд улитки-конуса и рецептор, на который он действует",Яна Комарова,Биология,,Статьи
0,/indicator_clear_text/2017_05_27_nobelevskie-laureaty-aleksis-karrel_,indicator.ru,https://indicator.ru/article/2017/05/27/nobelevskie-laureaty-aleksis-karrel/,2017_05_27,Нобелевские лауреаты: Алексис Каррель,Отец сосудистого шва,Алексей Паевский,Медицина,,Статьи
0,/indicator_clear_text/2016_10_19_istoriya-nauki-novaya-gvineya-tyan-shan-i-krugosvetka_,indicator.ru,https://indicator.ru/article/2016/10/19/istoriya-nauki-novaya-gvineya-tyan-shan-i-krugosvetka/,2016_10_19,"История науки: Новая Гвинея, Тянь-Шань и кругосветка ",Прошел 171 год с начала работы Русского географического общества,Алёна Манузина,Науки о Земле,,Статьи
0,/indicator_clear_text/2016_12_09_istoriya-nauki-indikator-x-y_,indicator.ru,https://indicator.ru/article/2016/12/09/istoriya-nauki-indikator-x-y/,2016_12_09,История науки: индикатор X-Y,48 лет назад была представлена компьютерная мышь,Алена Манузина,Технические науки,,Статьи
0,/indicator_clear_text/2017_01_12_hram-nauki-i-kultury_,indicator.ru,https://indicator.ru/article/2017/01/12/hram-nauki-i-kultury/,2017_01_12,Дорога к храму и благие намерения: Исаакиевский собор передают РПЦ,Чего ждут и чего боятся научные сотрудники музея-памятника «Исаакиевский собор»,Дарья Сапрыкина,Гуманитарные науки,,Статьи
0,/indicator_clear_text/2016_11_21_istoriya-lzhenauki-poverit-esli-ochen-hochetsya_,indicator.ru,https://indicator.ru/article/2016/11/21/istoriya-lzhenauki-poverit-esli-ochen-hochetsya/,2016_11_21,"Поверить, если очень хочется: история одной мистификации",104 года назад мир узнал о находке Пилтдаунского человека,Алёна Манузина,Гуманитарные науки,,Статьи
0,/indicator_clear_text/2016_10_09_selskoe-hozyajstvo_,indicator.ru,https://indicator.ru/article/2016/10/09/selskoe-hozyajstvo/,2016_10_09,Каждому картофелю по паспорту: как ФАНО выполняло указы президента,Как российские генетики помогают импортозамещению в сельскохозяйственной отрасли,Анастасия Лебедева,Сельское хозяйство,,Статьи
0,/indicator_clear_text/2017_04_19_ernest-rezerford_,indicator.ru,https://indicator.ru/article/2017/04/19/ernest-rezerford/,2017_04_19,Нобелевские лауреаты: Эрнест Резерфорд ,По прозвищу «Крокодил»,Алексей Паевский,Физика,,Статьи
0,/indicator_clear_text/2017_02_13_digest-nauchpopa-13-19-fevralya_,indicator.ru,https://indicator.ru/article/2017/02/13/digest-nauchpopa-13-19-fevralya/,2017_02_13,Дайджест научно-популярных мероприятий 13.02 – 19.02,Самые интересные научно-популярные мероприятия недели в Москве,Анастасия Ковалева,Биология,,Статьи
0,/indicator_clear_text/2017_11_13_dajdzhest-13-19-noyabrya_,indicator.ru,https://indicator.ru/article/2017/11/13/dajdzhest-13-19-noyabrya/,2017_11_13,Дайджест научно-популярных мероприятий 13.11 – 19.11,Самые интересные научно-популярные мероприятия недели,Анастасия Ксенофонтова,Астрономия,,Статьи
0,/indicator_clear_text/2017_08_10_naukometriya-ot-majkla-kurca-otzyvy_,indicator.ru,https://indicator.ru/article/2017/08/10/naukometriya-ot-majkla-kurca-otzyvy/,2017_08_10,"«Выхода нет, и приходится в это играть»: как правильно применять наукометрию",Российские специалисты по наукометрии отвечают на статью астронома Майкла Курца,Алёна Манузина,Технические науки,,Статьи
0,/indicator_clear_text/2017_04_13_elias-lennrot-otec-kalevaly_,indicator.ru,https://indicator.ru/article/2017/04/13/elias-lennrot-otec-kalevaly/,2017_04_13,История науки: «будитель финской нации»,"215 лет назад родился лингвист, издавший «Калевалу»",Алёна Манузина,Гуманитарные науки,,Статьи
0,/indicator_clear_text/2016_09_29_chto-v-dissere-tebe-moem-dissovetam-prigrozili-nauchnymi-shkolami_,indicator.ru,https://indicator.ru/article/2016/09/29/chto-v-dissere-tebe-moem-dissovetam-prigrozili-nauchnymi-shkolami/,2016_09_29,«Что в диссере тебе моем?»: диссоветам пригрозили научными школами,None,Марина Киселёва,Гуманитарные науки,,Статьи
0,/indicator_clear_text/2016_11_23_vspomnit-vse-po-sobachi_,indicator.ru,https://indicator.ru/article/2016/11/23/vspomnit-vse-po-sobachi/,2016_11_23,«Вспомнить все» по-собачьи: у собак найден аналог эпизодической памяти,"Венгерские этологи обнаружили, что собаки могут помнить некоторые действия хозяев",Екатерина Мищенко,Биология,,Статьи
0,/indicator_clear_text/2016_09_29_astrofiziki-usomnilis-vo-vselennoj_,indicator.ru,https://indicator.ru/article/2016/09/29/astrofiziki-usomnilis-vo-vselennoj/,2016_09_29,Астрофизики усомнились во Вселенной,Ученые раскрыли роль диффузии в ранней Вселенной,,Астрономия,,Статьи
0,/indicator_clear_text/2016_12_01_zapah-smerti_,indicator.ru,https://indicator.ru/article/2016/12/01/zapah-smerti/,2016_12_01,Запах смерти: электроника принюхивается к бомбам и раку,Как ученые используют достижения природы для борьбы с раком и терроризмом,Екатерина Мищенко,Технические науки,,Статьи
0,/indicator_clear_text/2017_05_20_science-slam-artyom-akshintsev_,indicator.ru,https://indicator.ru/article/2017/05/20/science-slam-artyom-akshintsev/,2017_05_20,Охотники за цианобактериями: что скрывают тропы и гейзеры Камчатки,Видео выступлений участников научного шоу Science Slam,,Науки о Земле,,Статьи
0,/indicator_clear_text/2017_02_10_test-bees-and-maths_,indicator.ru,https://indicator.ru/article/2017/02/10/test-bees-and-maths/,2017_02_10,За пчелами с математикой: тест от Indicator.Ru,,,Математика и Computer Science,,Статьи
0,/indicator_clear_text/2017_03_20_obshee-sobranie-ran-onlajn_,indicator.ru,https://indicator.ru/article/2017/03/20/obshee-sobranie-ran-onlajn/,2017_03_20,Общее собрание РАН. Онлайн ,Что происходит в Академии вместо выборов президента,Марина Киселева,Технические науки,,Статьи
0,/indicator_clear_text/2017_01_14_trishkin-kaftan-ilona-maska_,indicator.ru,https://indicator.ru/article/2017/01/14/trishkin-kaftan-ilona-maska/,2017_01_14,Тришкин кафтан Илона Маска,Чем SpaceX заМАСКирует дыры в бюджете,,Технические науки,,Статьи
0,/indicator_clear_text/2016_09_29_bassejn-bez-vody-moloko-bez-korovy_,indicator.ru,https://indicator.ru/article/2016/09/29/bassejn-bez-vody-moloko-bez-korovy/,2016_09_29,"Бассейн без воды, молоко без коровы",Журнал Nature опубликовал статью о состоянии российской науки,Анастасия Ковалева,Гуманитарные науки,,Статьи
0,/indicator_clear_text/2017_08_07_carl-ritter_,indicator.ru,https://indicator.ru/article/2017/08/07/carl-ritter/,2017_08_07,Откуда есть пошло жизненное пространство,238 лет назад родился географ Карл Риттер,Алёна Манузина,Науки о Земле,,Статьи
0,/indicator_clear_text/2017_08_21_insyte-electronics-umnyi-dom_,indicator.ru,https://indicator.ru/article/2017/08/21/insyte-electronics-umnyi-dom/,2017_08_21,"Ума палата: кто, как и зачем делает дома умнее",Глава INSYTE Electronics о своем бизнесе,Алёна Манузина,Технические науки,,Статьи
0,/indicator_clear_text/2016_12_28_samoe-vazhnoe-na-svete-somnenie_,indicator.ru,https://indicator.ru/article/2016/12/28/samoe-vazhnoe-na-svete-somnenie/,2016_12_28,«Самое важное на свете — сомнение»: лекция Симона Шноля об истории науки,Николай Тимофеев-Ресовский и рождение молекулярной биологии,,Биология,,Статьи
0,/indicator_clear_text/2017_04_21_istoriya-nauki-itstrebitel-la-5_,indicator.ru,https://indicator.ru/article/2017/04/21/istoriya-nauki-itstrebitel-la-5/,2017_04_21,История науки: самолет для аса,75 лет назад совершил свой первый полет истребитель Ла-5,Алексей Паевский,Технические науки,,Статьи
0,/indicator_clear_text/2017_05_31_nobelevskie-laureaty-viktor-grinyar_,indicator.ru,https://indicator.ru/article/2017/05/31/nobelevskie-laureaty-viktor-grinyar/,2017_05_31,Нобелевские лауреаты: Виктор Гриньяр ,Отец металлоорганической химии,Алексей Паевский,Химия и науки о материалах,,Статьи
0,/indicator_clear_text/2016_12_07_elektrony-zabludivshiesya-v-kvantovyh-sosnah_,indicator.ru,https://indicator.ru/article/2016/12/07/elektrony-zabludivshiesya-v-kvantovyh-sosnah/,2016_12_07,"Электроны, заблудившиеся в квантовых «соснах»",Связанные электроны позволят приблизиться к созданию квантового компьютера,,Физика,,Статьи
0,/indicator_clear_text/2017_05_28_intervyu-cognitive-technologies_,indicator.ru,https://indicator.ru/article/2017/05/28/intervyu-cognitive-technologies/,2017_05_28,«Чиновника искусственный интеллект уже сейчас спокойно заменит»,"Глава компании Cognitive Technologies о роботах, искусственном интеллекте и правительственной поддержке",Марина Киселева,Математика и Computer Science,,Статьи
0,/indicator_clear_text/2017_03_01_velikaya-gonka-za-dinozavrami_,indicator.ru,https://indicator.ru/article/2017/03/01/velikaya-gonka-za-dinozavrami/,2017_03_01,История науки: война на костях,145 лет назад началась «Великая гонка за динозаврами»,Екатерина Мищенко,Биология,,Статьи
0,/indicator_clear_text/2017_03_17_nurofen_,indicator.ru,https://indicator.ru/article/2017/03/17/nurofen/,2017_03_17,Чем нас лечат: Нурофен. Лечит ли популярный препарат от боли,Indicator.Ru разбирает популярное обезболивающее ,Екатерина Мищенко,Медицина,,Статьи
0,/indicator_clear_text/2016_10_14_istoriya-nauki-bystree-zvuka_,indicator.ru,https://indicator.ru/article/2016/10/14/istoriya-nauki-bystree-zvuka/,2016_10_14,История науки: быстрее звука,69 лет назад человек впервые преодолел звуковой барьер,Алёна Манузина,Технические науки,,Статьи
0,/indicator_clear_text/2017_05_29_istoriya-nauki-arthur-eddington_,indicator.ru,https://indicator.ru/article/2017/05/29/istoriya-nauki-arthur-eddington/,2017_05_29,"История науки: один эксперимент, две теории и много облаков",98 лет назад было получено доказательство теории относительности,Алёна Манузина,Астрономия,,Статьи
0,/indicator_clear_text/2017_03_22_vyhod-rabochyh-s-fabriki-lumyer_,indicator.ru,https://indicator.ru/article/2017/03/22/vyhod-rabochyh-s-fabriki-lumyer/,2017_03_22,Взгляд с экрана: почему люди XIX века пугались обыкновенного поезда,22 марта 1895 года братья Люмьер впервые показали публике фильм,Виктория Барановская,Технические науки,,Статьи
0,/indicator_clear_text/2017_05_05_iskluchenie-zhurnalov-iz-rinc_,indicator.ru,https://indicator.ru/article/2017/05/05/iskluchenie-zhurnalov-iz-rinc/,2017_05_05,Содиум и Гоморра: какие «новые» вещества можно найти в научных статьях,К дискуссии о качестве рецензирования российских журналов,,Химия и науки о материалах,,Статьи
0,/indicator_clear_text/2017_02_08_nobelevskie-laureaty-per-kyuri_,indicator.ru,https://indicator.ru/article/2017/02/08/nobelevskie-laureaty-per-kyuri/,2017_02_08,Нобелевские лауреаты: Пьер Кюри,Первый исследователь радиации,Алексей Паевский,Физика,,Статьи
0,/indicator_clear_text/2017_02_20_interview-golubev_,indicator.ru,https://indicator.ru/article/2017/02/20/interview-golubev/,2017_02_20,"«Аналитика заканчивается, и остается одна политика»: историк о докладе «Какое прошлое нужно будущему России»",,Артем Космарский,Гуманитарные науки,,Статьи
0,/indicator_clear_text/2016_11_21_intervyu-nigmatulina_,indicator.ru,https://indicator.ru/article/2016/11/21/intervyu-nigmatulina/,2016_11_21,Термояд на столе: интервью Роберта Нигматулина,Директор ИО РАН рассказал о перспективах альтернативной энергетики,Дарья Сапрыкина,Науки о Земле,,Статьи
0,/indicator_clear_text/2017_10_22_pervyj-parashyutist_,indicator.ru,https://indicator.ru/article/2017/10/22/pervyj-parashyutist/,2017_10_22,Популяризация управляемым падением,220 лет назад Андре-Жак Гарнерен совершил первый прыжок с парашютом с воздушного шара,Алексей Паевский,Технические науки,,Статьи
0,/indicator_clear_text/2016_09_29_chtoby-ne-bylo-lya-lya_,indicator.ru,https://indicator.ru/article/2016/09/29/chtoby-ne-bylo-lya-lya/,2016_09_29,Чтобы не было «ля-ля»: что ученые думают по поводу итоговых школьных сочинений,Ученые рассуждают о темах школьных итоговых сочинений,Дарья Сапрыкина,Гуманитарные науки,,Статьи
0,/indicator_clear_text/2016_11_24_istoriya-nauki-lyusi-upavshaya-s-dereva_,indicator.ru,https://indicator.ru/article/2016/11/24/istoriya-nauki-lyusi-upavshaya-s-dereva/,2016_11_24,Как Люси с дерева упала,42 года назад найден самый полный скелет австралопитека,Алексей Паевский,Биология,,Статьи
0,/indicator_clear_text/2016_12_15_instant-coffee_,indicator.ru,https://indicator.ru/article/2016/12/15/instant-coffee/,2016_12_15,Неповторимый растворимый: научный взгляд на растворимый кофе,Что такое растворимый кофе и с чем его пьют,Алексей Паевский,Сельское хозяйство,,Статьи
0,/indicator_clear_text/2016_11_29_kto-lyubit-ushami_,indicator.ru,https://indicator.ru/article/2016/11/29/kto-lyubit-ushami/,2016_11_29,"Любить ушами: какой звук надо повторять, чтобы понравиться собеседнику","Ученые выяснили, как люди оценивают приятность голоса",Анастасия Лебедева,Физика,,Статьи
0,/indicator_clear_text/2017_02_03_kakaya-vy-zvezda_,indicator.ru,https://indicator.ru/article/2017/02/03/kakaya-vy-zvezda/,2017_02_03,Какая вы звезда? Сверхновый тест от Indicator.Ru," Определитесь, на какую звезду вы похожи больше всего",Екатерина Мищенко,Астрономия,,Статьи
0,/indicator_clear_text/2016_09_29_afrikanskaya-chuma-svinej-bolezn-zagadochnaya_,indicator.ru,https://indicator.ru/article/2016/09/29/afrikanskaya-chuma-svinej-bolezn-zagadochnaya/,2016_09_29,«Африканская чума свиней — болезнь загадочная»,Российские ученые нашли способ победить вирус африканской чумы свиней,Яна Комарова,Сельское хозяйство,,Статьи
0,/indicator_clear_text/2017_10_20_dzhek-ma_,indicator.ru,https://indicator.ru/article/2017/10/20/dzhek-ma/,2017_10_20,Миллиардер по-китайски: как стать успешным по версии Джека Ма,11 тезисов одного из богатейших технологических предпринимателей мира,Марина Киселева,Технические науки,,Статьи
0,/indicator_clear_text/2017_02_08_publikacionnaya-aktivnost-rossiyskih-uchenyh_,indicator.ru,https://indicator.ru/article/2017/02/08/publikacionnaya-aktivnost-rossiyskih-uchenyh/,2017_02_08,Будь в доле: растет ли доля российских публикаций в мировых базах данных,,Марина Киселева,Технические науки,,Статьи
0,/indicator_clear_text/2017_11_16_kvantorium_,indicator.ru,https://indicator.ru/article/2017/11/16/kvantorium/,2017_11_16,«А потом к нему приезжает наш голубой вагон»,Наука для школьников в самых отдаленных уголках России,Анастасия Лебедева,Технические науки,,Статьи
0,/indicator_clear_text/2017_03_18_okoshko-v-zheleznom-zanavese_,indicator.ru,https://indicator.ru/article/2017/03/18/okoshko-v-zheleznom-zanavese/,2017_03_18,История науки: окошко в «железном занавесе»,57 лет назад вышел первый выпуск «Клуба кинопутешественников»,Екатерина Мищенко,Науки о Земле,,Статьи
0,/indicator_clear_text/2017_09_25_obshee-sobranie-ran-onlajn_,indicator.ru,https://indicator.ru/article/2017/09/25/obshee-sobranie-ran-onlajn/,2017_09_25,Общее собрание РАН. Онлайн ,Что происходит в Академии перед выборами президента,Марина Киселева,Технические науки,,Статьи
0,/indicator_clear_text/2016_11_19_istoriya-nauki-nashe-nauchnoe-vsyo_,indicator.ru,https://indicator.ru/article/2016/11/19/istoriya-nauki-nashe-nauchnoe-vsyo/,2016_11_19,История науки: наше научное все,305 лет назад родился Михаил Васильевич Ломоносов,Алексей Паевский,Химия и науки о материалах,,Статьи
0,/indicator_clear_text/2017_10_20_pan-sputnik-saturna_,indicator.ru,https://indicator.ru/article/2017/10/20/pan-sputnik-saturna/,2017_10_20,"Наследие Cassini: Пан, который не пропал",Спутник-пастух с необычным внешним видом,Алексей Паевский,Астрономия,,Статьи
0,/indicator_clear_text/2016_11_28_dajdzhest-nauchno-populyarnyh-sobytij-28-11-4-12_,indicator.ru,https://indicator.ru/article/2016/11/28/dajdzhest-nauchno-populyarnyh-sobytij-28-11-4-12/,2016_11_28,Дайджест научно-популярных событий 28.11 – 4.12,Cамые интересные научно-популярные мероприятия на этой неделе в Москве,Анастасия Ковалева,Биология,,Статьи
0,/indicator_clear_text/2017_05_23_mify-pro-mikrovolnovki_,indicator.ru,https://indicator.ru/article/2017/05/23/mify-pro-mikrovolnovki/,2017_05_23,Макроглупости про микроволновки: мифы о СВЧ-печах,Пять мифов о СВЧ-печах,Анастасия Ковалева,Технические науки,,Статьи
0,/indicator_clear_text/2017_04_20_chem-nas-lechat-kagocel_,indicator.ru,https://indicator.ru/article/2017/04/20/chem-nas-lechat-kagocel/,2017_04_20,Чем нас лечат: Кагоцел. Аргументы «за» и «против» антивирусного препарата,Помогает ли лекарство против вирусов,Екатерина Мищенко,Медицина,,Статьи
0,/indicator_clear_text/2017_05_03_vilgelm-ostvald_,indicator.ru,https://indicator.ru/article/2017/05/03/vilgelm-ostvald/,2017_05_03,Нобелевские лауреаты: Вильгельм Оствальд ,Создатель теории катализа,Алексей Паевский,Химия и науки о материалах,,Статьи
0,/indicator_clear_text/2016_09_29_200-tysyach-za-kandidatskuyu-vam-dorogo_,indicator.ru,https://indicator.ru/article/2016/09/29/200-tysyach-za-kandidatskuyu-vam-dorogo/,2016_09_29,«200 тысяч за кандидатскую – вам дорого?»,За сколько можно купить диссертацию,Дарья Сапрыкина,Гуманитарные науки,,Статьи
