,path,source,url,date,title,subtitle,author,rubrics,tags,genre
0,/indicator_clear_text/2016_12_30_chem-pahnet-novyj-god_,indicator.ru,https://indicator.ru/article/2016/12/30/chem-pahnet-novyj-god/,2016_12_30,Чем пахнет Новый год,О природе новогодних запахов,Дарья Сапрыкина,Химия и науки о материалах,,Статьи
0,/indicator_clear_text/2017_11_06_kuda-idti-na-festivale-premii-prosvetitel_,indicator.ru,https://indicator.ru/article/2017/11/06/kuda-idti-na-festivale-premii-prosvetitel/,2017_11_06,Куда идти на фестивале премии «Просветитель»: выбор редакции Indicator.Ru,Гид по лучшим событиям фестиваля премии «Просветитель»,Анастасия Ксенофонтова,Медицина,,Статьи
0,/indicator_clear_text/2017_03_19_dajdzhest-nauchno-populyarnyh-meropriyatij-20-03-26-03_,indicator.ru,https://indicator.ru/article/2017/03/19/dajdzhest-nauchno-populyarnyh-meropriyatij-20-03-26-03/,2017_03_19,Дайджест научно-популярных мероприятий 20.03 – 26.03,Самые интересные научно-популярные мероприятия недели,Анастасия Ковалева,Гуманитарные науки,,Статьи
0,/indicator_clear_text/2016_10_06_pivnye-migranty-sostavleno-genealogicheskoe-drevo-mikroorganizmov_,indicator.ru,https://indicator.ru/article/2016/10/06/pivnye-migranty-sostavleno-genealogicheskoe-drevo-mikroorganizmov/,2016_10_06,Пивные мигранты: составлено генеалогическое древо дрожжей,None,Анастасия Лебедева,Биология,,Статьи
0,/indicator_clear_text/2017_08_31_polezny-li-grudnye-sbory-ot-kashlya_,indicator.ru,https://indicator.ru/article/2017/08/31/polezny-li-grudnye-sbory-ot-kashlya/,2017_08_31,Чем нас лечат: грудные сборы. Помогают ли травки от кашля,Разбор полезных и вредных свойств смесей из лекарственных трав,Екатерина Мищенко,Медицина,,Статьи
0,/indicator_clear_text/2016_11_14_zhurnaly-v-musorku_,indicator.ru,https://indicator.ru/article/2016/11/14/zhurnaly-v-musorku/,2016_11_14,Журналы в мусорку: как следят за качеством научных изданий,Как будет приостанавливаться индексация журналов в Scopus,Марина Киселёва,Технические науки,,Статьи
0,/indicator_clear_text/2017_05_06_istoriya-nauki-krushenie-nebesnogo-titanika_,indicator.ru,https://indicator.ru/article/2017/05/06/istoriya-nauki-krushenie-nebesnogo-titanika/,2017_05_06,История науки: крушение небесного «Титаника»,80 лет назад погиб дирижабль «Гинденбург»,Екатерина Мищенко,Технические науки,,Статьи
0,/indicator_clear_text/2016_09_29_iz-massy-v-energiyu-i-obratno_,indicator.ru,https://indicator.ru/article/2016/09/29/iz-massy-v-energiyu-i-obratno/,2016_09_29,История науки: из массы в энергию и обратно,None,Алёна Манузина,Физика,,Статьи
0,/indicator_clear_text/2016_11_01_izbrannye-chleny-ran-po-otdeleniyu-nano-i-infotehnologij_,indicator.ru,https://indicator.ru/article/2016/11/01/izbrannye-chleny-ran-po-otdeleniyu-nano-i-infotehnologij/,2016_11_01,Избранные члены РАН по отделению нано- и инфотехнологий,None,,Математика и Computer Science,,Статьи
0,/indicator_clear_text/2017_02_19_istoriya-nauki-pervyj-politehnicheskij_,indicator.ru,https://indicator.ru/article/2017/02/19/istoriya-nauki-pervyj-politehnicheskij/,2017_02_19,История науки: первый политехнический,118 лет назад было принято решение о создании Санкт-Петербургского политехнического института,Алексей Паевский,Технические науки,,Статьи
0,/indicator_clear_text/2016_12_09_renewable-sources-of-energy_,indicator.ru,https://indicator.ru/article/2016/12/09/renewable-sources-of-energy/,2016_12_09,Окна возможностей для солнца и ветра: об альтернативной энергетике в России,Россия и переход к возобновляемой энергетике,,Технические науки,,Статьи
0,/indicator_clear_text/2016_10_22_kak-sobrat-opticheskij-kompyuter_,indicator.ru,https://indicator.ru/article/2016/10/22/kak-sobrat-opticheskij-kompyuter/,2016_10_22,Как собрать оптический компьютер,Максим Щербаков рассказывает о суперкомпьютерах и фотонике,,Математика и Computer Science,,Статьи
0,/indicator_clear_text/2017_10_15_festival-molodezhi-i-studentov_,indicator.ru,https://indicator.ru/article/2017/10/15/festival-molodezhi-i-studentov/,2017_10_15,"«Большие вызовы» — не угрозы, а возможности. Наука на Фестивале молодежи",О научной программе Всемирного фестиваля молодежи и студентов,,Гуманитарные науки,,Статьи
0,/indicator_clear_text/2016_09_29_dajdzhest-nauchno-populyarnyh-sobytij-26-09-02-10_,indicator.ru,https://indicator.ru/article/2016/09/29/dajdzhest-nauchno-populyarnyh-sobytij-26-09-02-10/,2016_09_29,Дайджест научно-популярных событий 26.09 - 02.10,"Список самых интересных научно-популярных мероприятий, проходящих на неделе в Москве, по мнению Indicator.Ru",Анастасия Ковалева,Гуманитарные науки,,Статьи
0,/indicator_clear_text/2016_12_23_homo-invitricus_,indicator.ru,https://indicator.ru/article/2016/12/23/homo-invitricus/,2016_12_23,Homo invitricus: этические проблемы использования человеческих эмбрионов,Наука будущего или издевательство над будущими людьми?,Екатерина Мищенко,Биология,,Статьи
0,/indicator_clear_text/2016_10_07_spi-spokojno-onkokletka_,indicator.ru,https://indicator.ru/article/2016/10/07/spi-spokojno-onkokletka/,2016_10_07,"Спи спокойно, онкоклетка: найден способ останавливать развитие опухолей","Пептид, связанный с болезнью Альцгеймера, «усыпляет» клетки опухоли",Екатерина Мищенко,Биология,,Статьи
0,/indicator_clear_text/2016_11_30_igry-v-kotorye-igrayut-mashiny_,indicator.ru,https://indicator.ru/article/2016/11/30/igry-v-kotorye-igrayut-mashiny/,2016_11_30,"Игры, в которые играют машины: о шахматных программах",Кто играет в игры лучше — компьютер или человек?,Дарья Сапрыкина,Математика и Computer Science,,Статьи
0,/indicator_clear_text/2017_09_12_intervyu-s-osnovatelem-duolingo_,indicator.ru,https://indicator.ru/article/2017/09/12/intervyu-s-osnovatelem-duolingo/,2017_09_12,Чат-боты против учителя: как работают приложения по изучению иностранных языков,Интервью с основателем сервиса Duolingo,Марина Киселева,Гуманитарные науки,,Статьи
0,/indicator_clear_text/2016_10_12_istoriya-nauki-pervyj-kosmicheskij-ekipazh_,indicator.ru,https://indicator.ru/article/2016/10/12/istoriya-nauki-pervyj-kosmicheskij-ekipazh/,2016_10_12,История науки: первый космический экипаж,52 года назад был запущен многоместный космический корабль «Восход-1» ,Алёна Манузина,Технические науки,,Статьи
0,/indicator_clear_text/2017_09_28_kogo-vybrali-v-prezidium-ran_,indicator.ru,https://indicator.ru/article/2017/09/28/kogo-vybrali-v-prezidium-ran/,2017_09_28,Все признаки омоложения налицо: кого выбрали в президиум РАН,Как завершилась выборная неделя в РАН,Марина Киселева,Технические науки,,Статьи
0,/indicator_clear_text/2017_05_02_dissertatsii--po-sovokupnosti-otmena-zaschit_,indicator.ru,https://indicator.ru/article/2017/05/02/dissertatsii--po-sovokupnosti-otmena-zaschit/,2017_05_02,«Хорошо известный на Западе формат» или «бредятина»: что думают эксперты о степенях «по совокупности»,Indicator.Ru узнал мнение экспертов о присуждении степеней по совокупности заслуг,"Авторы: Анастасия Ковалева, Марина Киселева",Технические науки,,Статьи
0,/indicator_clear_text/2016_11_07_digest-nauchno-populyarnyh-sobytij-07-11-13-11_,indicator.ru,https://indicator.ru/article/2016/11/07/digest-nauchno-populyarnyh-sobytij-07-11-13-11/,2016_11_07,Дайджест научно-популярных событий 07.11 – 13.11,Самые интересные научно-популярные мероприятия Москвы по мнению Indicator.Ru,Анастасия Ковалева,Технические науки,,Статьи
0,/indicator_clear_text/2016_09_29_liposomu-izuchat-ik-spektroskopiej_,indicator.ru,https://indicator.ru/article/2016/09/29/liposomu-izuchat-ik-spektroskopiej/,2016_09_29,Липосому изучат ИК-спектроскопией,Ученые МГУ усовершенствовали методы анализа живых клеток с помощью ИК-спектроскопии,Яна Комарова,Химия и науки о материалах,,Статьи
0,/indicator_clear_text/2016_10_20_kletochnye-nanokonvejery_,indicator.ru,https://indicator.ru/article/2016/10/20/kletochnye-nanokonvejery/,2016_10_20,Клеточные наноконвейеры,Виктория Буник рассказывает о механизмах функционирования клетки,,Биология,,Статьи
0,/indicator_clear_text/2017_08_08_sofijskij-sobor-v-vologde_,indicator.ru,https://indicator.ru/article/2017/08/08/sofijskij-sobor-v-vologde/,2017_08_08,Российские древности: Софийский собор в Вологде,"Церковь, на которую обиделся Иван Грозный",Алексей Паевский,Гуманитарные науки,,Статьи
0,/indicator_clear_text/2016_12_07_go-bashmaki-i-kolba_,indicator.ru,https://indicator.ru/article/2016/12/07/go-bashmaki-i-kolba/,2016_12_07,"Го, башмаки и колба: что лауреаты подарили Нобелевскому музею",Репортаж Indicator.Ru с первого официального визита нобелиатов в Стокгольме,Марина Киселева,Гуманитарные науки,,Статьи
0,/indicator_clear_text/2016_10_27_no-pochemu-my-pokazyvaem-strashnye-novosti-dnem-a-lekcii-stivena-hokinga-za-polnoch_,indicator.ru,https://indicator.ru/article/2016/10/27/no-pochemu-my-pokazyvaem-strashnye-novosti-dnem-a-lekcii-stivena-hokinga-za-polnoch/,2016_10_27,"Космонавт Сергей Волков: «Мы не умеем говорить о том, что мы делаем»",Космонавт Сергей Волков — о трудностях и радостях популяризации науки в России,Сергей Волков,Астрономия,,Статьи
0,/indicator_clear_text/2017_08_19_homo-roboticus-dzhon-markoff_,indicator.ru,https://indicator.ru/article/2017/08/19/homo-roboticus-dzhon-markoff/,2017_08_19,"Взлет, падение и возрождение искусственного интеллекта",Отрывок из книги Джона Маркоффа «Homo Roboticus? Люди и машины в поисках взаимопонимания»,,Математика и Computer Science,,Статьи
0,/indicator_clear_text/2017_10_08_dajdzhest-nauchno-populyarnyh-meropriyatij-9-10-15-10_,indicator.ru,https://indicator.ru/article/2017/10/08/dajdzhest-nauchno-populyarnyh-meropriyatij-9-10-15-10/,2017_10_08,Дайджест научно-популярных мероприятий 9.10 – 15.10 ,Самые интересные научно-популярные мероприятия недели,Анастасия Ксенофонтова,Медицина,,Статьи
0,/indicator_clear_text/2016_10_25_nevezenie-galua_,indicator.ru,https://indicator.ru/article/2016/10/25/nevezenie-galua/,2016_10_25,История науки: Невезение Галуа,В этот день в 1811 году родился самый неудачливый в мире математик,Алексей Паевский,Математика и Computer Science,,Статьи
0,/indicator_clear_text/2016_10_06_lektorij-indicator-ru-v-ramkah-festivalya-nauki_,indicator.ru,https://indicator.ru/article/2016/10/06/lektorij-indicator-ru-v-ramkah-festivalya-nauki/,2016_10_06,"Мамонты, наноконвейеры и суперкомпьютер: лекторий в рамках Фестиваля науки ","8 октября в Москве ученые, приглашенные Indicator.Ru, прочитают научно-популярные лекции",,Гуманитарные науки,,Статьи
0,/indicator_clear_text/2016_12_01_galaktiki-kannibaly_,indicator.ru,https://indicator.ru/article/2016/12/01/galaktiki-kannibaly/,2016_12_01,«Паутина» родилась из облака: как зарождались протогалактики,"Ученые выяснили, что протогалактики могли образовываться из облаков холодного газа",Владимир Покровский,Астрономия,,Статьи
0,/indicator_clear_text/2017_09_04_examus_,indicator.ru,https://indicator.ru/article/2017/09/04/examus/,2017_09_04,Не дайте себя обмануть: как проверяют результаты онлайн-курсов,"Вычислить обманщиков, найти шпаргалки и старших товарищей",Алёна Манузина,Технические науки,,Статьи
0,/indicator_clear_text/2017_01_13_ne-ver-glazam-svoim_,indicator.ru,https://indicator.ru/article/2017/01/13/ne-ver-glazam-svoim/,2017_01_13,"Не верь глазам своим: тест, посвященный научным микро- и макро-фотографиям","Иногда все окружающее не то, чем кажется.",Екатерина Мищенко,Биология,,Статьи
0,/indicator_clear_text/2017_03_08_nobelevskie-laureaty-filipp-lenard_,indicator.ru,https://indicator.ru/article/2017/03/08/nobelevskie-laureaty-filipp-lenard/,2017_03_08,Нобелевские лауреаты: Филипп Ленард,"Физик-нацист, противник Эйнштейна и Рентгена",Алексей Паевский,Физика,,Статьи
0,/indicator_clear_text/2017_07_26_avgust-krog_,indicator.ru,https://indicator.ru/article/2017/07/26/avgust-krog/,2017_07_26,Нобелевские лауреаты: Август Крог,Специалист по капиллярам,Алексей Паевский,Биология,,Статьи
0,/indicator_clear_text/2017_01_12_korolev_,indicator.ru,https://indicator.ru/article/2017/01/12/korolev/,2017_01_12,"История науки: человек, подаривший нам космос",110 лет со дня рождения Сергея Королева,Алексей Паевский,Астрономия,,Статьи
0,/indicator_clear_text/2016_10_13_novyj-geroj-solnechnoj-sistemy_,indicator.ru,https://indicator.ru/article/2016/10/13/novyj-geroj-solnechnoj-sistemy/,2016_10_13,Где искать Девятую планету,"Сможет ли карликовое небесное тело доказать существование Планеты Х, выяснял Indicator.Ru",Дарья Сапрыкина,Астрономия,,Статьи
0,/indicator_clear_text/2017_11_01_sir-owen-richardson_,indicator.ru,https://indicator.ru/article/2017/11/01/sir-owen-richardson/,2017_11_01,Нобелевские лауреаты: сэр Оуэн Ричардсон. Газ из электронов,Еще один выпускник Кавендишской лаборатории,Алексей Паевский,Физика,,Статьи
0,/indicator_clear_text/2017_01_30_uchenye-protiv-mifov_,indicator.ru,https://indicator.ru/article/2017/01/30/uchenye-protiv-mifov/,2017_01_30,Ученые сверху: репортаж с форума популяризаторов науки,Борцы против мифов и проблема уважения,Артем Космарский,Гуманитарные науки,,Статьи
0,/indicator_clear_text/2017_05_18_suprastin_,indicator.ru,https://indicator.ru/article/2017/05/18/suprastin/,2017_05_18, Чем нас лечат: Супрастин. Не для астматиков и водителей,Достоинства и недостатки популярного препарата от аллергии,Екатерина Мищенко,Медицина,,Статьи
0,/indicator_clear_text/2017_02_07_istoriya-nauki_,indicator.ru,https://indicator.ru/article/2017/02/07/istoriya-nauki/,2017_02_07,История науки: одна любовь ко многим почвам,118 лет назад родился химик и почвовед Ханс Дженни,Алёна Манузина,Сельское хозяйство,,Статьи
0,/indicator_clear_text/2016_11_04_tvoi-goda-a-ih-bogatstvo_,indicator.ru,https://indicator.ru/article/2016/11/04/tvoi-goda-a-ih-bogatstvo/,2016_11_04,"Твои года, а их — богатство: поможет ли крем победить морщины",Поможет ли крем от морщин победить возраст?,Дарья Сапрыкина,Медицина,,Статьи
0,/indicator_clear_text/2017_02_20_dajdzhest-nauchno-populyarnyh-meropriyatij-20-02-26-02_,indicator.ru,https://indicator.ru/article/2017/02/20/dajdzhest-nauchno-populyarnyh-meropriyatij-20-02-26-02/,2017_02_20,Дайджест научно-популярных мероприятий 20.02 – 26.02,Самые интересные научно-популярные мероприятия недели,Анастасия Ковалева,Медицина,,Статьи
0,/indicator_clear_text/2016_10_14_vybory-ran-fizika_,indicator.ru,https://indicator.ru/article/2016/10/14/vybory-ran-fizika/,2016_10_14,Выборы в РАН: отделение физических наук,Indicator.Ru приводит подробные данные по кандидатам на выборах в РАН по отделению физических наук,Анастасия Лебедева,Физика,,Статьи
0,/indicator_clear_text/2016_12_29_lyudi-smogut-s-butylkoj-piva-nablyudat-za-nobelevskoj-ceremoniej_,indicator.ru,https://indicator.ru/article/2016/12/29/lyudi-smogut-s-butylkoj-piva-nablyudat-za-nobelevskoj-ceremoniej/,2016_12_29,Смотреть Нобеля с бутылкой пива: интервью архитектора Нобелевского центра,Каким будет новое здание для вручения знаменитой премии,Марина Киселева,Технические науки,,Статьи
0,/indicator_clear_text/2017_09_18_recenziya-shelk-i-kremnij-garten_,indicator.ru,https://indicator.ru/article/2017/09/18/recenziya-shelk-i-kremnij-garten/,2017_09_18,История глобализации как сказка о Золушке: рецензия на книгу «От шелка до кремния»,Как не надо писать исторические книги,Яна Хлюстова,Гуманитарные науки,,Статьи
0,/indicator_clear_text/2016_11_16_biogibridy-kiborgi-sushestvuyut_,indicator.ru,https://indicator.ru/article/2016/11/16/biogibridy-kiborgi-sushestvuyut/,2016_11_16,Биогибриды: киборги существуют!,Подборка самых интересных биогибридных технологий с начала года,Екатерина Мищенко,Биология,,Статьи
0,/indicator_clear_text/2017_07_18_istoriya-volapyuka_,indicator.ru,https://indicator.ru/article/2017/07/18/istoriya-volapyuka/,2017_07_18,"Как найти общий язык: история создания, славы и падения волапюка",186 лет со дня рождения автора одного из самых успешных искусственных языков,Алёна Манузина,Гуманитарные науки,,Статьи
0,/indicator_clear_text/2016_12_10_samoe-slozhnoe-eto-dobitsya-izyashestva_,indicator.ru,https://indicator.ru/article/2016/12/10/samoe-slozhnoe-eto-dobitsya-izyashestva/,2016_12_10,«Самое сложное — это добиться изящества»: нобелевский повар о ежегодном банкете,Шеф-повар Нобелевского банкета рассказал Indicator.Ru об особенностях главного научного ужина года,Марина Киселева,Гуманитарные науки,,Статьи
0,/indicator_clear_text/2017_02_05_istoriya-nauki-den-himicheskoj-zashity_,indicator.ru,https://indicator.ru/article/2017/02/05/istoriya-nauki-den-himicheskoj-zashity/,2017_02_05,История науки: день химической защиты,101 год назад был испытан первый эффективный противогаз,Алексей Паевский,Химия и науки о материалах,,Статьи
0,/indicator_clear_text/2016_12_01_lyusi-na-dereve_,indicator.ru,https://indicator.ru/article/2016/12/01/lyusi-na-dereve/,2016_12_01,Где жила Люси: подробности о жизни нашего самого известного предка,"Палеонтологи выяснили, что Люси возможно жила на деревьях","Авторы: Анастасия Лебедева, Анастасия Ковалева",Биология,,Статьи
0,/indicator_clear_text/2016_12_26_dajdzhest-nauchno-populyarnyh-meropriyatij-26-12-01-01_,indicator.ru,https://indicator.ru/article/2016/12/26/dajdzhest-nauchno-populyarnyh-meropriyatij-26-12-01-01/,2016_12_26,Дайджест научно-популярных мероприятий 26.12 – 01.01,Самые интересные научно-популярные мероприятия этой недели в Москве ,Анастасия Ковалева,Астрономия,,Статьи
0,/indicator_clear_text/2017_10_26_copter-express_,indicator.ru,https://indicator.ru/article/2017/10/26/copter-express/,2017_10_26,Почему мы не видим в небе много дронов: как делают беспилотники в России,Разработка дронов в России на примере одного стартапа,Алёна Манузина,Технические науки,,Статьи
0,/indicator_clear_text/2017_08_24_fridrich-josef-gaaz_,indicator.ru,https://indicator.ru/article/2017/08/24/fridrich-josef-gaaz/,2017_08_24,Пруссак на русской службе: за что тюремного врача хотят причислить к лику святых,237 лет назад родился российский врач и гуманист Федор Гааз,Алексей Паевский,Медицина,,Статьи
0,/indicator_clear_text/2016_11_01_izbrannye-chleny-ran-po-otdeleniyu-himii-i-nauk-o-materialah_,indicator.ru,https://indicator.ru/article/2016/11/01/izbrannye-chleny-ran-po-otdeleniyu-himii-i-nauk-o-materialah/,2016_11_01,Избранные члены РАН по отделению химии и наук о материалах,None,,Химия и науки о материалах,,Статьи
0,/indicator_clear_text/2017_09_19_startap-lechebnaya-fizkultura_,indicator.ru,https://indicator.ru/article/2017/09/19/startap-lechebnaya-fizkultura/,2017_09_19,"«Надо выходить из лабораторий и узнавать, кому это нужно»: опыт медицинского стартапера",Российский телемедицинский стартап поможет следить за выполнением упражнений лечебной физкультуры,Екатерина Мищенко,Медицина,,Статьи
