,path,source,url,date,title,subtitle,author,rubrics,tags,genre
0,/indicator_clear_text/2017_03_29_chto-chitaet-sovremennaya-intelligenciya_,indicator.ru,https://indicator.ru/article/2017/03/29/chto-chitaet-sovremennaya-intelligenciya/,2017_03_29,Маргинальное чтиво: что и почему читает современная «интеллигенция»,Неожиданные результаты изучения литературных вкусов у разных профессий,Екатерина Мищенко,Гуманитарные науки,,Статьи
0,/indicator_clear_text/2017_07_24_majoranovskie-fermiony_,indicator.ru,https://indicator.ru/article/2017/07/24/majoranovskie-fermiony/,2017_07_24,"Частица-ангел, пришедшая на смену частице Бога",Спустя 80 лет после предсказания физики доказали существование майорановского фермиона,Владимир Покровский,Физика,,Статьи
0,/indicator_clear_text/2017_01_20_mir-zhivogo-ot-multfilmov-do-nedavnih-otkrytij_,indicator.ru,https://indicator.ru/article/2017/01/20/mir-zhivogo-ot-multfilmov-do-nedavnih-otkrytij/,2017_01_20,"В поисках Немо, ежиков и тихоходок",Проверьте сообразительность и свои знания по биологии,Екатерина Мищенко,Биология,,Статьи
0,/indicator_clear_text/2017_05_30_istoriya-nauki-georg-peuerbach_,indicator.ru,https://indicator.ru/article/2017/05/30/istoriya-nauki-georg-peuerbach/,2017_05_30,История науки: за сто лет до Коперника,594 года со дня рождения австрийского астронома Георга Пурбаха,Алёна Манузина,Астрономия,,Статьи
0,/indicator_clear_text/2016_11_09_votes-in-usa_,indicator.ru,https://indicator.ru/article/2016/11/09/votes-in-usa/,2016_11_09,«Эту технологию надо пересобирать»: в чем ошибались прогнозы выборов в США,Как делаются прогнозы выборов и почему они оказались неверны,Алёна Манузина,Математика и Computer Science,,Статьи
0,/indicator_clear_text/2016_09_29_magmaticheskaya-provinciya-najdena-v-sibiri_,indicator.ru,https://indicator.ru/article/2016/09/29/magmaticheskaya-provinciya-najdena-v-sibiri/,2016_09_29,Магматическая провинция найдена в Сибири,Геологи открыли в России крупную магматическую провинцию возрастом 1.5 миллиарда лет,,Науки о Земле,,Статьи
0,/indicator_clear_text/2016_12_06_russian-science-citation-index_,indicator.ru,https://indicator.ru/article/2016/12/06/russian-science-citation-index/,2016_12_06,База колебаний: как российские журналы попадали в базу данных RSCI,Как создавался российский рейтинг научных журналов,,Технические науки,,Статьи
0,/indicator_clear_text/2017_01_25_gde-kuyut-oligarhov_,indicator.ru,https://indicator.ru/article/2017/01/25/gde-kuyut-oligarhov/,2017_01_25,Где куют олигархов: какие вузы закончили самые богатые люди России,,Анастасия Лебедева,Технические науки,,Статьи
0,/indicator_clear_text/2017_02_28_rene-reomyur_,indicator.ru,https://indicator.ru/article/2017/02/28/rene-reomyur/,2017_02_28,История науки: от нуля до восьмидесяти,334 года назад родился создатель температурной шкалы Рене Реомюр,Алёна Манузина,Технические науки,,Статьи
0,/indicator_clear_text/2017_10_10_drone-employee_,indicator.ru,https://indicator.ru/article/2017/10/10/drone-employee/,2017_10_10,«Один вылет требует огромной бюрократической волокиты»: стартаперы о рынке дронов,"Блокчейн, «умные контракты», селфи и беспилотники в интервью руководителей стартапа Drone Employee",Алёна Манузина,Технические науки,,Статьи
0,/indicator_clear_text/2017_05_20_atlas-mira-abrahama-orteliusa_,indicator.ru,https://indicator.ru/article/2017/05/20/atlas-mira-abrahama-orteliusa/,2017_05_20,История науки: позорище всея вселенной,447 лет назад вышел в свет первый географический атлас,Алексей Паевский,Науки о Земле,,Статьи
0,/indicator_clear_text/2016_10_18_hirshefobiya-i-prorok-valaam-i-vvedenie_,indicator.ru,https://indicator.ru/article/2016/10/18/hirshefobiya-i-prorok-valaam-i-vvedenie/,2016_10_18,Хиршефобия и пророк Валаам: как работает наукометрия,Физик Игорь Ерухимович рассуждает о хиршелюбах и хиршефобах,,Технические науки,,Статьи
0,/indicator_clear_text/2017_09_12_dissernet_,indicator.ru,https://indicator.ru/article/2017/09/12/dissernet/,2017_09_12,Право и академическая этика не пересекаются: эксперты спорят о новых «плагиатных» поправках,Помогают ли поправки в закон бороться с плагиаторами,Артем Космарский,Технические науки,,Статьи
0,/indicator_clear_text/2016_11_25_kollajdery-v-rossii_,indicator.ru,https://indicator.ru/article/2016/11/25/kollajdery-v-rossii/,2016_11_25,Как перестать бояться и полюбить коллайдер,Итоги XXV Всероссийской конференции по ускорителям заряженных частиц,,Физика,,Статьи
0,/indicator_clear_text/2017_08_13_rossijskie-drevnosti-ferapontov-monastyr-i-freski-dionisiya_,indicator.ru,https://indicator.ru/article/2017/08/13/rossijskie-drevnosti-ferapontov-monastyr-i-freski-dionisiya/,2017_08_13,Российские древности: Ферапонтов монастырь и фрески Дионисия,Самый совершенный архитектурно-фресковый ансамбль,Алексей Паевский,Гуманитарные науки,,Статьи
0,/indicator_clear_text/2016_11_28_interview-anna-sherbina_,indicator.ru,https://indicator.ru/article/2016/11/28/interview-anna-sherbina/,2016_11_28,Ответ на кадровый вызов: о съезде молодых ученых,Как воспитать новое молодое поколение российских ученых,Indicator.Ru,Гуманитарные науки,,Статьи
0,/indicator_clear_text/2017_02_09_pochemu-zemlya-ne-stala-red-and-dead_,indicator.ru,https://indicator.ru/article/2017/02/09/pochemu-zemlya-ne-stala-red-and-dead/,2017_02_09,Почему Земля не стала «red and dead»,В культурно-просветительском центре «Архэ» начался курс лекций по палеонтологии,,Науки о Земле,,Статьи
0,/indicator_clear_text/2016_12_12_intervyu-evgeniya-kuznecova_,indicator.ru,https://indicator.ru/article/2016/12/12/intervyu-evgeniya-kuznecova/,2016_12_12,"«Необходимо, чтобы работали люди»: как наука взаимодействует с бизнесом",И.о. главы РВК о коммерциализации науки в России,Яна Хлюстова,Технические науки,,Статьи
0,/indicator_clear_text/2016_12_22_top-10-science_,indicator.ru,https://indicator.ru/article/2016/12/22/top-10-science/,2016_12_22,Топ-10 научных открытий по версии Science,Что важного произошло в науке в 2016 году,Анастасия Лебедева,Технические науки,,Статьи
0,/indicator_clear_text/2017_05_26_istoriya-lipkoy-lenty-skotcha_,indicator.ru,https://indicator.ru/article/2017/05/26/istoriya-lipkoy-lenty-skotcha/,2017_05_26,"История науки: о скотч, ты мир! ",87 лет назад был получен патент на прозрачную клейкую ленту,Екатерина Мищенко,Технические науки,,Статьи
0,/indicator_clear_text/2017_02_14_istoriya-raskladki-qwerty_,indicator.ru,https://indicator.ru/article/2017/02/14/istoriya-raskladki-qwerty/,2017_02_14,История науки: соло на клавиатуре,198 лет назад родился «папа» раскладки QWERTY,Алёна Манузина,Технические науки,,Статьи
0,/indicator_clear_text/2016_10_17_yajcekletka_,indicator.ru,https://indicator.ru/article/2016/10/17/yajcekletka/,2016_10_17,"Расти, яйцеклетка, большая и маленькая",Ученые вырастили функциональную яйцеклетку мыши,Алёна Манузина,Биология,,Статьи
0,/indicator_clear_text/2017_03_02_opticheskiy-telegraf_,indicator.ru,https://indicator.ru/article/2017/03/02/opticheskiy-telegraf/,2017_03_02,История науки: тайное оружие Монте-Кристо,228 лет назад в Париже заработал оптический телеграф,Алексей Паевский,Технические науки,,Статьи
0,/indicator_clear_text/2017_04_07_nauka-s-borodoj-test_,indicator.ru,https://indicator.ru/article/2017/04/07/nauka-s-borodoj-test/,2017_04_07,Тест: наука с бородой,Узнайте ученого по бороде в новом тесте от Indicator.Ru,Наиль  Фарукшин,Технические науки,,Статьи
0,/indicator_clear_text/2016_11_01_hirsh-znacheniya-ne-imeet_,indicator.ru,https://indicator.ru/article/2016/11/01/hirsh-znacheniya-ne-imeet/,2016_11_01,Хирш значения не имеет: только каждый пятый ученый с высоким Хиршем победил на выборах в РАН,,Дарья Сапрыкина,Технические науки,,Статьи
0,/indicator_clear_text/2017_08_09_kak-fano-ocenivaet-nauchnye-organizacii_,indicator.ru,https://indicator.ru/article/2017/08/09/kak-fano-ocenivaet-nauchnye-organizacii/,2017_08_09,"«Институт могут ликвидировать, это не исключено»: чиновники оценят ученых",К концу года ФАНО проведет оценку научных организаций,"Авторы: Алёна Манузина, Марина Киселева",Технические науки,,Статьи
0,/indicator_clear_text/2017_06_14_sharl-kulon_,indicator.ru,https://indicator.ru/article/2017/06/14/sharl-kulon/,2017_06_14,История науки: непростое украшение,281 год назад родился Шарль Огюстен Кулон,Владимир Покровский,Физика,,Статьи
0,/indicator_clear_text/2017_02_20_stanciya-mir_,indicator.ru,https://indicator.ru/article/2017/02/20/stanciya-mir/,2017_02_20,История науки: дивный новый «Мир»,31 год с момента запуска на орбиту космической станции «Мир»,Алексей Паевский,Астрономия,,Статьи
0,/indicator_clear_text/2016_11_25_po-telefonu-lechat-tolko-volshebniki_,indicator.ru,https://indicator.ru/article/2016/11/25/po-telefonu-lechat-tolko-volshebniki/,2016_11_25, «По телефону лечат только волшебники»: эпидемии гриппа нет,Когда на самом деле ждать основной волны гриппа и как от него уберечься,Екатерина Мищенко,Медицина,,Статьи
0,/indicator_clear_text/2017_05_19_simplonskiy-tonnel_,indicator.ru,https://indicator.ru/article/2017/05/19/simplonskiy-tonnel/,2017_05_19,История науки: 20 километров за семь лет,111 лет назад открылся один из длиннейших тоннелей мира,Алёна Манузина,Технические науки,,Статьи
0,/indicator_clear_text/2016_10_07_istoriya-nauki-ctrl-c-ctrl-v_,indicator.ru,https://indicator.ru/article/2016/10/07/istoriya-nauki-ctrl-c-ctrl-v/,2016_10_07,"История науки: Ctrl+C, Ctrl+V",210 лет назад англичанин Ральф Веджвуд получил патент на копировальную бумагу,,Технические науки,,Статьи
0,/indicator_clear_text/2016_11_14_naych-pop-digest-14.11-19.11_,indicator.ru,https://indicator.ru/article/2016/11/14/naych-pop-digest-14.11-19.11/,2016_11_14,Дайджест научно-популярных событий 14.11 – 20.11,"Самые интересные научно-популярные мероприятия, проходящие на этой неделе в Москве",Анастасия Ковалева,Астрономия,,Статьи
0,/indicator_clear_text/2017_01_30_vetvistousye-rachki-iz-hyperborei_,indicator.ru,https://indicator.ru/article/2017/01/30/vetvistousye-rachki-iz-hyperborei/,2017_01_30,Родом из Гипербореи: как ветвистоусые рачки расселялись по Палеоарктике,,Екатерина Мищенко,Биология,,Статьи
0,/indicator_clear_text/2017_05_02_rossijskie-drevnosti-pokrovskij-monastyr-v-suzdale_,indicator.ru,https://indicator.ru/article/2017/05/02/rossijskie-drevnosti-pokrovskij-monastyr-v-suzdale/,2017_05_02,Российские древности: Покровский монастырь в Суздале,Тюрьма для высокопоставленных узниц и талантливых ученых,Алексей Паевский,Гуманитарные науки,,Статьи
0,/indicator_clear_text/2016_11_16_intervyu-kabanova_,indicator.ru,https://indicator.ru/article/2016/11/16/intervyu-kabanova/,2016_11_16,Больше постдоков для российской науки: интервью с Александром Кабановым,Как меняется жизнь ученых после мегагранта и чего не хватило российской науке,Марина Киселёва,Химия и науки о материалах,,Статьи
0,/indicator_clear_text/2017_04_18_rossijskie-drevnosti-svirskaya-cerkov-v-smolenske_,indicator.ru,https://indicator.ru/article/2017/04/18/rossijskie-drevnosti-svirskaya-cerkov-v-smolenske/,2017_04_18,Российские древности: Свирская церковь в Смоленске,"«Храм, каких больше нет»",Алексей Паевский,Гуманитарные науки,,Статьи
0,/indicator_clear_text/2016_12_20_koktejlnaya-vecherinka_,indicator.ru,https://indicator.ru/article/2016/12/20/koktejlnaya-vecherinka/,2016_12_20,Много шума из ничего: как мозг распознает звуки в шумной обстановке,"Американские исследователи установили, как работает слуховая кора человеческого мозга",Анастасия Лебедева,Медицина,,Статьи
0,/indicator_clear_text/2017_05_29_dajdzhest-nauchno-populyarnyh-meropriyatij-29-05-04-06_,indicator.ru,https://indicator.ru/article/2017/05/29/dajdzhest-nauchno-populyarnyh-meropriyatij-29-05-04-06/,2017_05_29,Дайджест научно-популярных мероприятий 29.05 – 04.06,Самые интересные научно-популярные мероприятия недели,,Технические науки,,Статьи
0,/indicator_clear_text/2017_09_12_peshera-lasko_,indicator.ru,https://indicator.ru/article/2017/09/12/peshera-lasko/,2017_09_12,"Пещера, открытая молнией",77 лет назад были обнаружены наскальные рисунки Ласко,Владимир Покровский,Гуманитарные науки,,Статьи
0,/indicator_clear_text/2017_03_03_paevskiy-o-medicine_,indicator.ru,https://indicator.ru/article/2017/03/03/paevskiy-o-medicine/,2017_03_03,«Опытный врач во многих случаях лучше выпускника современного медвуза»,Заметки на полях диалога о медицине,Алексей Паевский,Медицина,,Статьи
0,/indicator_clear_text/2017_08_20_voyager2_,indicator.ru,https://indicator.ru/article/2017/08/20/voyager2/,2017_08_20,Полет длиною в жизнь: сорок лет пути за пределы Солнечной системы,40 лет назад с Земли стартовал Voyager 2,Алексей Паевский,Астрономия,,Статьи
0,/indicator_clear_text/2017_03_07_velikiy-sholkovyy-put_,indicator.ru,https://indicator.ru/article/2017/03/07/velikiy-sholkovyy-put/,2017_03_07,Тропы скотоводов: тайная предыстория Великого шелкового пути,Тайная предыстория Великого шелкового пути,Артем Космарский,Гуманитарные науки,,Статьи
0,/indicator_clear_text/2017_03_07_rossiyskiye-vuzy-v-reytinge-qs_,indicator.ru,https://indicator.ru/article/2017/03/07/rossiyskiye-vuzy-v-reytinge-qs/,2017_03_07,«Важно очень осторожно подходить к рейтингам»: опубликован предметный рейтинг QS,Российские университеты достигли наивысших позиций в рейтинге QS в истории,Марина Киселева,Технические науки,,Статьи
0,/indicator_clear_text/2017_06_21_maks-fon-laue_,indicator.ru,https://indicator.ru/article/2017/06/21/maks-fon-laue/,2017_06_21,Нобелевские лауреаты: Макс фон Лауэ. Отец современной кристаллографии,Нобелиат по физике 1914 года,Алексей Паевский,Физика,,Статьи
0,/indicator_clear_text/2017_08_16_nanograd-sirius_,indicator.ru,https://indicator.ru/article/2017/08/16/nanograd-sirius/,2017_08_16,Ролевая игра с нанокотиками ,Ценности естественнонаучного и технического образования детям объяснили с помощью нанокотиков,Яна Тихомирова,Технические науки,,Статьи
0,/indicator_clear_text/2016_11_09_tramponauka_,indicator.ru,https://indicator.ru/article/2016/11/09/tramponauka/,2016_11_09,Трампонаука: что ученые думают о новом президенте,Чего ждать ученым и NASA от нового президента США,Артем Космарский,Гуманитарные науки,,Статьи
0,/indicator_clear_text/2017_05_30_konkurs-ege-spetsialnosti_,indicator.ru,https://indicator.ru/article/2017/05/30/konkurs-ege-spetsialnosti/,2017_05_30,Реалисты учат китайский: куда хотят поступать абитуриенты,Анализ наиболее интересных специальностей ведущих вузов,Марина Киселева,Гуманитарные науки,,Статьи
0,/indicator_clear_text/2017_03_03_actovegin_,indicator.ru,https://indicator.ru/article/2017/03/03/actovegin/,2017_03_03,"Чем нас лечат: Актовегин. Разрешен в России, но не в США и Канаде",Indicator.Ru анализирует эффективность одного из лидеров продаж в российских аптеках,Екатерина Мищенко,Медицина,,Статьи
0,/indicator_clear_text/2017_10_17_test-kem-ty-stanesh-v-nauke-cherez-10-let_,indicator.ru,https://indicator.ru/article/2017/10/17/test-kem-ty-stanesh-v-nauke-cherez-10-let/,2017_10_17,Тест: кем ты станешь в науке через 10 лет?,"Почувствуйте себя молодым ученым и проверьте, чем обернется ваше будущее в ближайшее время",Екатерина Мищенко,Технические науки,,Статьи
0,/indicator_clear_text/2017_11_14_chto-ran-dumaet-pro-vak-i-vse-eti-dissertacii_,indicator.ru,https://indicator.ru/article/2017/11/14/chto-ran-dumaet-pro-vak-i-vse-eti-dissertacii/,2017_11_14,«День открытых дверей в зоопарке»: что РАН думает про ВАК и все эти диссертации,Репортаж с президиума Российской академии наук,Марина Киселева,Технические науки,,Статьи
0,/indicator_clear_text/2017_07_02_ekspertnyj-sovet-rnf_,indicator.ru,https://indicator.ru/article/2017/07/02/ekspertnyj-sovet-rnf/,2017_07_02,"Будем приглашать к работе, но без выкручивания рук: как совершенствовать экспертизу РНФ",В Российском научном фонде прошло заседание экспертного совета по научным проектам,Яна Хлюстова,Технические науки,,Статьи
0,/indicator_clear_text/2017_06_08_meksidol-antioksidanty_,indicator.ru,https://indicator.ru/article/2017/06/08/meksidol-antioksidanty/,2017_06_08,Чем нас лечат: Мексидол и другие антиоксиданты   ,Насколько полезны антиоксиданты,Екатерина Мищенко,Медицина,,Статьи
0,/indicator_clear_text/2016_11_02_tri-missii-rejtinga_,indicator.ru,https://indicator.ru/article/2016/11/02/tri-missii-rejtinga/,2016_11_02,Три миссии рейтинга: зачем создан Московский международный рейтинг университетов,МГУ представил международный рейтинг вузов «Три миссии университета»,Марина Киселева,Гуманитарные науки,,Статьи
0,/indicator_clear_text/2017_07_04_ovechka-dolli_,indicator.ru,https://indicator.ru/article/2017/07/04/ovechka-dolli/,2017_07_04,"Три матери, два отца и пышногрудая крестная: история овечки Долли",21 год назад на свет появилось самое известное клонированное животное,Владимир Покровский,Биология,,Статьи
0,/indicator_clear_text/2016_11_29_likhachev-rosatom_,indicator.ru,https://indicator.ru/article/2016/11/29/likhachev-rosatom/,2016_11_29,«Не сыграем на свадьбе — сыграем на похоронах»,Новый глава Росатома рассказал студентам о будущем энергетической отрасли,Марина Киселёва,Физика,,Статьи
0,/indicator_clear_text/2016_12_09_benkubbinity_,indicator.ru,https://indicator.ru/article/2016/12/09/benkubbinity/,2016_12_09,"Каша из железа, никеля и кальция",Как образовалось семейство металлических метеоритов,Владимир Покровский,Астрономия,,Статьи
0,/indicator_clear_text/2016_12_07_istoriya-nauki-tehasskij-koktejl-dlya-vechnogo-sna_,indicator.ru,https://indicator.ru/article/2016/12/07/istoriya-nauki-tehasskij-koktejl-dlya-vechnogo-sna/,2016_12_07,«Техасский коктейль» для вечного сна,34 года назад впервые была проведена смертная казнь посредством смертельной инъекции,Екатерина Мищенко,Химия и науки о материалах,,Статьи
0,/indicator_clear_text/2017_07_29_milye-kosti-kennevikskogo-cheloveka_,indicator.ru,https://indicator.ru/article/2017/07/29/milye-kosti-kennevikskogo-cheloveka/,2017_07_29,Милые кости кенневикского человека,"21 год назад нашли древний скелет, из-за которого поссорились ученые и индейцы",Екатерина Мищенко,Биология,,Статьи
0,/indicator_clear_text/2017_04_06_chem-nas-lechat-renni-omeprazol-kislotnost-jeludka_,indicator.ru,https://indicator.ru/article/2017/04/06/chem-nas-lechat-renni-omeprazol-kislotnost-jeludka/,2017_04_06,Ренни против Омепразола: чем лечить проблемы с желудком,Какими препаратами лечить изжогу,Екатерина Мищенко,Медицина,,Статьи
0,/indicator_clear_text/2017_03_30_aleksej-abrikosov_,indicator.ru,https://indicator.ru/article/2017/03/30/aleksej-abrikosov/,2017_03_30,История науки: рожденный в СССР гражданин США,30 марта 2017 года умер нобелевский лауреат по физике Алексей Абрикосов,Алексей Паевский,Физика,,Статьи
