path,source,url,date,title,subtitle,author,rubrics,tags,genre
chrdk.ru/news/news_issledovanie-pokazhet-deistvie-protivoepilepticheskikh-preparatov.txt,https://chrdk.ru/,https://chrdk.ru/news/issledovanie-pokazhet-deistvie-protivoepilepticheskikh-preparatov,13.11.2017,Масштабное исследование покажет действие противоэпилептических препаратов на здоровье плода,,,,Российская наука_Медицина,Новости
chrdk.ru/news/news_issledovateli-iz-rossii-i-belarusi-izmerili-soderzhanie-toksichnogo-oksida-v-mozge.txt,https://chrdk.ru/,https://chrdk.ru/news/issledovateli-iz-rossii-i-belarusi-izmerili-soderzhanie-toksichnogo-oksida-v-mozge,24.11.2017,Исследователи из России и Беларуси измерили содержание токсичного оксида в мозге,,,,Биология_Российская наука,Новости
chrdk.ru/news/news_istreblenie-slonov.txt,https://chrdk.ru/,https://chrdk.ru/news/istreblenie-slonov,21.02.2017,Истребление слонов в центральной Африке определили по навозным кучам,,,,Биология_Животные,Новости
chrdk.ru/news/news_itmo-nabiraet-v-magu-po-nauchnoi-kommunikatcii.txt,https://chrdk.ru/,https://chrdk.ru/news/itmo-nabiraet-v-magu-po-nauchnoi-kommunikatcii,14.07.2017,ИТМО снова набирает студентов в магистратуру по научной коммуникации,,,,Образование,Новости
chrdk.ru/news/news_itmo-vyigrali-chempionat-mira-po-programmirovaniyu-v-sedmoi-raz.txt,https://chrdk.ru/,https://chrdk.ru/news/itmo-vyigrali-chempionat-mira-po-programmirovaniyu-v-sedmoi-raz,25.05.2017,Студенты университета ИТМО выиграли чемпионат мира по программированию в седьмой раз,,,,Информационные технологии,Новости
chrdk.ru/news/news_ITMO_magister.txt,https://chrdk.ru/,https://chrdk.ru/news/ITMO_magister,28.06.2016,ИТМО набирает студентов в магистратуру по научным коммуникациям,,,,Наука в университетах,Новости
chrdk.ru/news/news_ITMO_metafast.txt,https://chrdk.ru/,https://chrdk.ru/news/ITMO_metafast,17.06.2016,Биологи написали программу для анализа совокупности генов,,,,Информационные технологии_Молекулярная биология_Российская наука_Наука в университетах,Новости
chrdk.ru/news/news_ivan_IV_portrait.txt,https://chrdk.ru/,https://chrdk.ru/news/ivan_IV_portrait,11.11.2017,Историки и физики разглядели прижизненный портрет Ивана Грозного,,,,Физика_История_Российская наука_Технологии,Новости
chrdk.ru/news/news_iz-42-poslednikh-snimkov-kassini-sdelali-masshtabnoe-foto-saturna.txt,https://chrdk.ru/,https://chrdk.ru/news/iz-42-poslednikh-snimkov-kassini-sdelali-masshtabnoe-foto-saturna,27.11.2017,Из 42 последних снимков «Кассини» сделали масштабное фото Сатурна,,,,Астрофизика,Новости
chrdk.ru/news/news_iz-gryazi-v-muzei-v-kitae-naiden-novyi-vid-pernatykh-dinozavrov.txt,https://chrdk.ru/,https://chrdk.ru/news/iz-gryazi-v-muzei-v-kitae-naiden-novyi-vid-pernatykh-dinozavrov,12.11.2016,Из грязи в музей: в Китае найден новый вид пернатых динозавров,,,,,Новости
chrdk.ru/news/news_iz-immunnoi-sistemy-bakterii-sdelali-magnitofon.txt,https://chrdk.ru/,https://chrdk.ru/news/iz-immunnoi-sistemy-bakterii-sdelali-magnitofon,24.11.2017,Из иммунной системы бактерии сделали магнитофон,,,,Молекулярная биология_Биология,Новости
chrdk.ru/news/news_iz-za-smartfonov-podrostki-massovo-ne-vysypayutsya.txt,https://chrdk.ru/,https://chrdk.ru/news/iz-za-smartfonov-podrostki-massovo-ne-vysypayutsya,19.10.2017,Из-за смартфонов подростки массово не высыпаются,,,,Психология_Социология,Новости
chrdk.ru/news/news_izbavit-ot-lishnikh-khromosom.txt,https://chrdk.ru/,https://chrdk.ru/news/izbavit-ot-lishnikh-khromosom,17.08.2017,Найден способ избавить клетки человека от лишних хромосом,,,,Генетика_Биология,Новости
chrdk.ru/news/news_izbiratelnaya-blokirovka-tcitokinov-pomozhet.txt,https://chrdk.ru/,https://chrdk.ru/news/izbiratelnaya-blokirovka-tcitokinov-pomozhet,08.11.2017,Избирательная блокировка цитокинов поможет в лечении аутоиммунных заболеваний,,,,Молекулярная биология,Новости
chrdk.ru/news/news_izmenenie-klimata-sdvigaet-pavodki-v-evrope.txt,https://chrdk.ru/,https://chrdk.ru/news/izmenenie-klimata-sdvigaet-pavodki-v-evrope,11.08.2017,Изменение климата сдвигает паводки в Европе,,,,Климат,Новости
chrdk.ru/news/news_izobretena-fleshka-dlya-diagnostiki-vich.txt,https://chrdk.ru/,https://chrdk.ru/news/izobretena-fleshka-dlya-diagnostiki-vich,25.11.2016,Изобретена флешка для диагностики ВИЧ,,,,,Новости
chrdk.ru/news/news_izuchenie_zaikaushhihsya_myshei_pomozhet_v_lechenie_rasstroistv_rechi_cheloveka.txt,https://chrdk.ru/,https://chrdk.ru/news/izuchenie_zaikaushhihsya_myshei_pomozhet_v_lechenie_rasstroistv_rechi_cheloveka,15.04.2016,"Чтобы лечить людей, ученые создали заикающихся мышей",,,,Науки о живом_Генетика_Биология_Животные,Новости
chrdk.ru/news/news_izverzhenie_filippinskogo_vulkana_zatmilo_globalnoe_poteplenie.txt,https://chrdk.ru/,https://chrdk.ru/news/izverzhenie_filippinskogo_vulkana_zatmilo_globalnoe_poteplenie,12.08.2016,Извержение филиппинского вулкана затмило глобальное потепление,,,,Физика_Геология_Информационные технологии_География,Новости
chrdk.ru/news/news_iz_pyli_komety_churumova_gerasimenko_mozhno_poluchit_komponenty_rnk.txt,https://chrdk.ru/,https://chrdk.ru/news/iz_pyli_komety_churumova_gerasimenko_mozhno_poluchit_komponenty_rnk,18.05.2016,Из пыли кометы Чурюмова — Герасименко можно получить компоненты РНК,,,,Астрономия_Науки о живом_Химия_Молекулярная биология_Российская наука_Репортаж_Видео,Новости
chrdk.ru/news/news_jets-were-seen.txt,https://chrdk.ru/,https://chrdk.ru/news/jets-were-seen,08.09.2017,«Гайя» случайно нашла у квазаров длинные «хвосты»,,,,Астрофизика,Новости
chrdk.ru/news/news_justinianic_plague.txt,https://chrdk.ru/,https://chrdk.ru/news/justinianic_plague,01.09.2016,"Биологи восстановили геном чумной палочки, вызвавшей пандемию в VI веке нашей эры",,,,Археология_История_Генетика_Микробиология_Антропология,Новости
chrdk.ru/news/news_kak-babki.txt,https://chrdk.ru/,https://chrdk.ru/news/kak-babki,19.06.2017,"Американские подростки малоподвижны, как старики",,,,Социология,Новости
chrdk.ru/news/news_kak-bozhya-korovka-skladyvaet-krylya.txt,https://chrdk.ru/,https://chrdk.ru/news/kak-bozhya-korovka-skladyvaet-krylya,15.05.2017,"Ученые разобрались, как божья коровка складывает крылья",,,,Науки о живом_Материаловедение_Биология,Новости
chrdk.ru/news/news_kak-chelovechestvo-pomnit-ob-aviakatastrofakh.txt,https://chrdk.ru/,https://chrdk.ru/news/kak-chelovechestvo-pomnit-ob-aviakatastrofakh,06.04.2017,"Википедия показала, как человечество помнит об авиакатастрофах",,,,Социология,Новости
chrdk.ru/news/news_kak-delat-kirpichi-na-marse.txt,https://chrdk.ru/,https://chrdk.ru/news/kak-delat-kirpichi-na-marse,28.04.2017,"Инженеры показали, как делать кирпичи на Марсе",,,,Материаловедение_Космос,Новости
chrdk.ru/news/news_kak-ebola-puteshestvovala.txt,https://chrdk.ru/,https://chrdk.ru/news/kak-ebola-puteshestvovala,13.04.2017,"Генетики показали, как Эбола путешествовала по Западной Африке",,,,Медицина,Новости
chrdk.ru/news/news_kak-flamingo-stoyat-na-odnoi-noge.txt,https://chrdk.ru/,https://chrdk.ru/news/kak-flamingo-stoyat-na-odnoi-noge,24.05.2017,Фламинго умеют стоять на одной ноге и после смерти,,,,Животные,Новости
chrdk.ru/news/news_kak-kamyshovki-razlichayut-vostok-i-zapad.txt,https://chrdk.ru/,https://chrdk.ru/news/kak-kamyshovki-razlichayut-vostok-i-zapad,12.11.2017,"Ученые показали, как камышовки различают восток и запад",,,,Физика_Науки о живом_Животные_Российская наука,Новости
chrdk.ru/news/news_kak-khakaton-no-hardaton.txt,https://chrdk.ru/,https://chrdk.ru/news/kak-khakaton-no-hardaton,20.04.2017,Аналог хакатона на тему интернета вещей пройдет в Сколтехе,,,,Информационные технологии,Новости
chrdk.ru/news/news_kak-komary-ubegayut-ot-svoikh-zhertv.txt,https://chrdk.ru/,https://chrdk.ru/news/kak-komary-ubegayut-ot-svoikh-zhertv,20.10.2017,"Ученые объяснили, как комары убегают от своих жертв",,,,Науки о живом_Животные,Новости
chrdk.ru/news/news_kak-pechatat-gologrammy-na-struinom-printere.txt,https://chrdk.ru/,https://chrdk.ru/news/kak-pechatat-gologrammy-na-struinom-printere,26.11.2017,"Ученые из ИТМО придумали, как печатать голограммы на струйном принтере",,,,Материаловедение_Российская наука,Новости
chrdk.ru/news/news_kak-pokachivayutsya-molekuly.txt,https://chrdk.ru/,https://chrdk.ru/news/kak-pokachivayutsya-molekuly,23.11.2017,"Физики проследили, как «покачиваются» молекулы в белковых кристаллах",,,,Физика_Российская наука,Новости
chrdk.ru/news/news_kalium_database.txt,https://chrdk.ru/,https://chrdk.ru/news/kalium_database,20.06.2016,Биохимики собрали базу данных ядов скорпионов,,,,Информационные технологии_Молекулярная биология_Биология,Новости
chrdk.ru/news/news_kamennye_orudiya_obezyan_mogut_zaputat_uchenyh.txt,https://chrdk.ru/,https://chrdk.ru/news/kamennye_orudiya_obezyan_mogut_zaputat_uchenyh,21.10.2016,«Каменные орудия» обезьян могут запутать археологов,,,,Науки о живом_Археология_Животные,Новости
chrdk.ru/news/news_kannabinoidy-gippokamp-ot-epilepsiya.txt,https://chrdk.ru/,https://chrdk.ru/news/kannabinoidy-gippokamp-ot-epilepsiya,22.03.2017,Каннабиноиды защитили гиппокамп от эпилепсии,,,,Нейронауки_Биология_Медицина,Новости
chrdk.ru/news/news_kannabis-umenshaet-uroven-dofamina.txt,https://chrdk.ru/,https://chrdk.ru/news/kannabis-umenshaet-uroven-dofamina,30.11.2016,Каннабис снижает уровень дофамина,,,,,Новости
chrdk.ru/news/news_kapli-vody-vzryvayutsya-grafitom-chtoby-tushit.txt,https://chrdk.ru/,https://chrdk.ru/news/kapli-vody-vzryvayutsya-grafitom-chtoby-tushit,15.11.2017,"Капли воды взрываются графитом, чтобы тушить пожары",,,,Российская наука_Технологии,Новости
chrdk.ru/news/news_karshering-pomogaet.txt,https://chrdk.ru/,https://chrdk.ru/news/karshering-pomogaet,07.07.2017,Принуждение к райдшерингу ускоряет городской трафик почти в два раза,,,,Социология_Урбанистика,Новости
chrdk.ru/news/news_kartinki_i_video_mozhno_budet_iskat_po_nabrosku.txt,https://chrdk.ru/,https://chrdk.ru/news/kartinki_i_video_mozhno_budet_iskat_po_nabrosku,03.06.2016,Поисковик ищет видео и картинки по наброску,,,,Математика_Информационные технологии_Футурология_Репортаж_Видео,Новости
chrdk.ru/news/news_kartofan-na-marse.txt,https://chrdk.ru/,https://chrdk.ru/news/kartofan-na-marse,10.03.2017,Куст картофеля вырос почти на Марсе,,,,Космос_Биология_Растения,Новости
chrdk.ru/news/news_kazan_quantum_network.txt,https://chrdk.ru/,https://chrdk.ru/news/kazan_quantum_network,08.08.2016,В России запустили первый сегмент квантовой сети,,,,Информационные технологии_Российская наука_Наука в университетах,Новости
chrdk.ru/news/news_kern-detektiv.txt,https://chrdk.ru/,https://chrdk.ru/news/kern-detektiv,04.09.2017,Антарктический лед уличил вулкан в порче озонового слоя и потеплении,,,,Климат_Гляциология,Новости
chrdk.ru/news/news_khimikaty-v-marianskoi-vpadine.txt,https://chrdk.ru/,https://chrdk.ru/news/khimikaty-v-marianskoi-vpadine,15.02.2017,Химикаты полувековой давности нашли в Марианской впадине,,,,Экология,Новости
chrdk.ru/news/news_khimiki_sozdali_datchik_dlia_brzopasnogo_zagara.txt,https://chrdk.ru/,https://chrdk.ru/news/khimiki_sozdali_datchik_dlia_brzopasnogo_zagara,30.05.2016,Химики создали нательный датчик для безопасного загара,,,,Химия_Технологии,Новости
chrdk.ru/news/news_khishchnaya-puzyrchatka-kopit-geny-nuzhnye-ei-dlya-okhoty.txt,https://chrdk.ru/,https://chrdk.ru/news/khishchnaya-puzyrchatka-kopit-geny-nuzhnye-ei-dlya-okhoty,16.05.2017,"Хищная пузырчатка «копит» гены, нужные ей для охоты",,,,Науки о живом_Генетика_Биология,Новости
chrdk.ru/news/news_khobbit--vykhodets-iz-afriki.txt,https://chrdk.ru/,https://chrdk.ru/news/khobbit--vykhodets-iz-afriki,24.04.2017,«Индонезийский хоббит» оказался древним выходцем из Африки,,,,Палеонтология_Антропология,Новости
chrdk.ru/news/news_khochesh-ponyat-sobesednika-zakroi-glaza.txt,https://chrdk.ru/,https://chrdk.ru/news/khochesh-ponyat-sobesednika-zakroi-glaza,11.10.2017,Хочешь понять собеседника — закрой глаза,,,,Психология,Новости
chrdk.ru/news/news_kholodny-marsu-voda-iz-lednikov.txt,https://chrdk.ru/,https://chrdk.ru/news/kholodny-marsu-voda-iz-lednikov,19.10.2017,По древнему холодному и ледяному Марсу текла вода из тающих ледников,,,,Астрофизика,Новости
chrdk.ru/news/news_khomyaki--migranty.txt,https://chrdk.ru/,https://chrdk.ru/news/khomyaki--migranty,09.11.2017,Европейские хомяки оказались мигрантами с Кавказа,,,,Науки о живом_Животные,Новости
chrdk.ru/news/news_khorosho-i-plokho.txt,https://chrdk.ru/,https://chrdk.ru/news/khorosho-i-plokho,08.08.2017,Counterstrike уменьшает серое вещество в гиппокампе,,,,Нейронауки,Новости
chrdk.ru/news/news_khudozhniki-vidyat-statichnye-obekty-arkhitektory-dinamichnye-granitcy.txt,https://chrdk.ru/,https://chrdk.ru/news/khudozhniki-vidyat-statichnye-obekty-arkhitektory-dinamichnye-granitcy,29.06.2017,"Художники видят статичные объекты, архитекторы — динамичные границы",,,,Психология_Социология_Лингвистика,Новости
chrdk.ru/news/news_kishechnaya_palochka_mozhet_byt_prichinoi_razvitiya_boleznei_parkinsona_i_altsgeimera.txt,https://chrdk.ru/,https://chrdk.ru/news/kishechnaya_palochka_mozhet_byt_prichinoi_razvitiya_boleznei_parkinsona_i_altsgeimera,06.10.2016,Кишечная палочка может быть причиной болезней Паркинсона и Альцгеймера,,,,Науки о живом_Нейронауки_Медицина,Новости
chrdk.ru/news/news_kishechnye-bakterii-ne-dayut-lyudyam-khudet.txt,https://chrdk.ru/,https://chrdk.ru/news/kishechnye-bakterii-ne-dayut-lyudyam-khudet,04.01.2017,Кишечные бактерии не дают людям худеть,,,,Еда_Микробиология,Новости
chrdk.ru/news/news_kishechnye-mikroby-pomogayut-borotsya-s-grippom.txt,https://chrdk.ru/,https://chrdk.ru/news/kishechnye-mikroby-pomogayut-borotsya-s-grippom,04.08.2017,Кишечные микробы помогают бороться с гриппом,,,,Биология_Микробиология,Новости
chrdk.ru/news/news_kitaiskii-adrenalin-vedet-sebya-neobychno.txt,https://chrdk.ru/,https://chrdk.ru/news/kitaiskii-adrenalin-vedet-sebya-neobychno,25.07.2017,Китайский адреналин из российской аптеки ведет себя необычно,,,,Химия_Биология,Новости
chrdk.ru/news/news_kladbishche-drevnikh-novgorodtcev.txt,https://chrdk.ru/,https://chrdk.ru/news/kladbishche-drevnikh-novgorodtcev,11.11.2017,Впервые найдено кладбище древних новгородцев,,,,Археология_История_Российская наука,Новости
chrdk.ru/news/news_kletchatka_oslablyaet_allergiu_na_arahis_u_myshei.txt,https://chrdk.ru/,https://chrdk.ru/news/kletchatka_oslablyaet_allergiu_na_arahis_u_myshei,22.06.2016,Клетчатка ослабляет аллергию на арахис у мышей,,,,Биология_Медицина_Микробиология,Новости
chrdk.ru/news/news_kletki-kozhi-vylechili-myshei-s-bolnymi-lapami.txt,https://chrdk.ru/,https://chrdk.ru/news/kletki-kozhi-vylechili-myshei-s-bolnymi-lapami,09.08.2017,Перепрограммированные клетки кожи вылечили мышей с больными лапами,,,,Генетика_Молекулярная биология,Новости
chrdk.ru/news/news_kletki-krichat-ob-opasnosti.txt,https://chrdk.ru/,https://chrdk.ru/news/kletki-krichat-ob-opasnosti,26.06.2017,Установлен механизм передачи сигнала тревоги из кишечника в мозг,,,,Нейронауки_Биология,Новости
chrdk.ru/news/news_kletochnoi-membrany-zhivoi-kletki-v-nanomasshtabe.txt,https://chrdk.ru/,https://chrdk.ru/news/kletochnoi-membrany-zhivoi-kletki-v-nanomasshtabe,31.05.2017,Получено первое изображение мембраны живой клетки в наномасштабе,,,,Молекулярная биология_Биология,Новости
chrdk.ru/news/news_klitoriya-pomogla-vyvesti-pervye-sinie-khrizantemy.txt,https://chrdk.ru/,https://chrdk.ru/news/klitoriya-pomogla-vyvesti-pervye-sinie-khrizantemy,26.07.2017,Клитория помогла вывести первые синие хризантемы,,,,Генетика_Биология_Растения,Новости
chrdk.ru/news/news_knowledge_recklessness_prediction.txt,https://chrdk.ru/,https://chrdk.ru/news/knowledge_recklessness_prediction,16.03.2017,Найдена связь между преступным умыслом и активностью мозга,,,,Социология_Нейронауки,Новости
chrdk.ru/news/news_kofein-protiv-parkinsona.txt,https://chrdk.ru/,https://chrdk.ru/news/kofein-protiv-parkinsona,09.03.2017,Кофеин эффективен против болезней Альцгеймера и Паркинсона,,,,,Новости
chrdk.ru/news/news_kogda-lyudi-stali-osedlymi.txt,https://chrdk.ru/,https://chrdk.ru/news/kogda-lyudi-stali-osedlymi,29.03.2017,"Мыши помогли выяснить, когда люди стали оседлыми",,,,Археология_Животные,Новости
chrdk.ru/news/news_kogda-zhili-iskopaemye-dikobrazy.txt,https://chrdk.ru/,https://chrdk.ru/news/kogda-zhili-iskopaemye-dikobrazy,26.11.2017,"Ученые выяснили, когда жили ископаемые дикобразы",,,,Палеонтология_Российская наука,Новости
chrdk.ru/news/news_koleblyushchiesya-galaktiki.txt,https://chrdk.ru/,https://chrdk.ru/news/koleblyushchiesya-galaktiki,27.10.2017,Телескоп «Хаббл» обнаружил колеблющиеся галактики,,,,Астрономия,Новости
chrdk.ru/news/news_kolonii-bakterii-po-dobrososedski.txt,https://chrdk.ru/,https://chrdk.ru/news/kolonii-bakterii-po-dobrososedski,11.04.2017,Колонии бактерий взаимодействуют по-добрососедски,,,,Биология_Микробиология,Новости
chrdk.ru/news/news_komarov_privlekaet_gormon_stressa_vyyasnili_amerikanskie_biologi.txt,https://chrdk.ru/,https://chrdk.ru/news/komarov_privlekaet_gormon_stressa_vyyasnili_amerikanskie_biologi,11.08.2016,"Комаров привлекает гормон стресса, выяснили американские биологи",,,,Науки о живом_Животные_Медицина,Новости
chrdk.ru/news/news_komary_umeut_opredelyat_aromat_cheloveka_na_osnove_ego_vkusa_i_zapaha.txt,https://chrdk.ru/,https://chrdk.ru/news/komary_umeut_opredelyat_aromat_cheloveka_na_osnove_ego_vkusa_i_zapaha,10.10.2016,Комары умеют определять аромат человека на основе его вкуса и запаха,,,,Науки о живом_Биология_Медицина,Новости
chrdk.ru/news/news_kompaktnye-gazovye-sensory-dlya-aes.txt,https://chrdk.ru/,https://chrdk.ru/news/kompaktnye-gazovye-sensory-dlya-aes,13.11.2017,Газовые сенсоры для АЭС и космических кораблей работают при комнатной температуре,,,,Физика_Химия_Материаловедение_Российская наука,Новости
chrdk.ru/news/news_komponent-kosmetiki-mozhet-byt-sverkhprovodnikom.txt,https://chrdk.ru/,https://chrdk.ru/news/komponent-kosmetiki-mozhet-byt-sverkhprovodnikom,04.10.2017,Компонент косметики может быть сверхпроводником,,,,Материаловедение,Новости
chrdk.ru/news/news_komputernaya_mysh_izmeryaet_uroven_stressa.txt,https://chrdk.ru/,https://chrdk.ru/news/komputernaya_mysh_izmeryaet_uroven_stressa,27.04.2016,Компьютерная мышь измеряет уровень стресса,,,,Технологии,Новости
chrdk.ru/news/news_kompyuter-nauchili-nakhodit-bolnye-eritrotcity.txt,https://chrdk.ru/,https://chrdk.ru/news/kompyuter-nauchili-nakhodit-bolnye-eritrotcity,19.10.2017,Компьютер научили находить больные эритроциты,,,,Информационные технологии_Биология_Медицина,Новости
chrdk.ru/news/news_kompyuternaya-model-vs-captcha.txt,https://chrdk.ru/,https://chrdk.ru/news/kompyuternaya-model-vs-captcha,26.10.2017,"Создана компьютерная модель, способная пройти тест CAPTCHA",,,,Информационные технологии,Новости
chrdk.ru/news/news_kontcentratciya-gaza-bet-rekordy.txt,https://chrdk.ru/,https://chrdk.ru/news/kontcentratciya-gaza-bet-rekordy,31.10.2017,Концентрация углекислого газа в атмосфере бьет рекорды,,,,Климат_Изменение климата,Новости
chrdk.ru/news/news_kontratceptiv-iz-kornya-oduvanchika.txt,https://chrdk.ru/,https://chrdk.ru/news/kontratceptiv-iz-kornya-oduvanchika,15.05.2017,Ученые получили контрацептив из корня одуванчика,,,,Молекулярная биология_Биология,Новости
chrdk.ru/news/news_kontrolirovat-ferromagnetiki-lazerom.txt,https://chrdk.ru/,https://chrdk.ru/news/kontrolirovat-ferromagnetiki-lazerom,11.11.2017,Российские ученые научились контролировать ферромагнетики лазером,,,,Физика,Новости
chrdk.ru/news/news_kopytnye-melchali.txt,https://chrdk.ru/,https://chrdk.ru/news/kopytnye-melchali,17.03.2017,Копытные мельчали во время потепления,,,,Палеонтология,Новости
