path,source,url,date,title,subtitle,author,rubrics,tags,genre
chrdk.ru/news/news_no_baby_boom_after_50_shades.txt,https://chrdk.ru/,https://chrdk.ru/news/no_baby_boom_after_50_shades,18.05.2017,«50 оттенков серого» не вызвали бума рождаемости,,,,Медицина_Статистика,Новости
chrdk.ru/news/news_no_feathers.txt,https://chrdk.ru/,https://chrdk.ru/news/no_feathers,07.06.2017,Тираннозавр все-таки не был пернатым,,,,Палеонтология,Новости
chrdk.ru/news/news_no_fish_for_penguins.txt,https://chrdk.ru/,https://chrdk.ru/news/no_fish_for_penguins,10.02.2017,Пингвины оказались в ловушке своих привычек,,,,Животные_Экология,Новости
chrdk.ru/news/news_no_liquid_water_on_f.txt,https://chrdk.ru/,https://chrdk.ru/news/no_liquid_water_on_f,09.06.2017,На пятой планете системы TRAPPIST-1 не нашли жидкую воду,,,,Астрономия,Новости
chrdk.ru/news/news_no_money-no_ARM.txt,https://chrdk.ru/,https://chrdk.ru/news/no_money-no_ARM,15.06.2017,NASA не будет ловить астероид,,,,Космос,Новости
chrdk.ru/news/news_nti.txt,https://chrdk.ru/,https://chrdk.ru/news/nti,02.10.2017,Всероссийская инженерная олимпиада для школьников открыла прием заявок,,,,Образование,Новости
chrdk.ru/news/news_numerical_reasoning_in_blind_and_sighted.txt,https://chrdk.ru/,https://chrdk.ru/news/numerical_reasoning_in_blind_and_sighted,20.09.2016,Мозг слепых использует зрительный центр для математических вычислений,,,,Нейронауки_Биология_Наука в университетах,Новости
chrdk.ru/news/news_o-novom-etape-kvantovogo-kompyutera.txt,https://chrdk.ru/,https://chrdk.ru/news/o-novom-etape-kvantovogo-kompyutera,16.11.2017,IBM объявила о новом этапе в создании квантового компьютера,,,,Квантовые технологии,Новости
chrdk.ru/news/news_obama_fish.txt,https://chrdk.ru/,https://chrdk.ru/news/obama_fish,26.12.2016,Новый вид рыб с Гавайев назвали в честь Барака Обамы,,,,Биология_Животные,Новости
chrdk.ru/news/news_obezyany-pomogayut-zabluzhdayushchimsya.txt,https://chrdk.ru/,https://chrdk.ru/news/obezyany-pomogayut-zabluzhdayushchimsya,07.04.2017,Обезьяны помогают заблуждающимся,,,,Науки о живом_Животные,Новости
chrdk.ru/news/news_obilie-kartinok-meshaet-uchit-slova.txt,https://chrdk.ru/,https://chrdk.ru/news/obilie-kartinok-meshaet-uchit-slova,04.07.2017,Обилие картинок в книжках мешает детям учить новые слова,,,,Психология,Новости
chrdk.ru/news/news_oblast-mozga-otvetstvennaya-za-snovideniya.txt,https://chrdk.ru/,https://chrdk.ru/news/oblast-mozga-otvetstvennaya-za-snovideniya,18.04.2017,"Обнаружена область мозга, ответственная за сновидения",,,,Нейронауки,Новости
chrdk.ru/news/news_obnaruzhen-novyi-dlya-rossii-vid-kleshchevogo-rikketsioza.txt,https://chrdk.ru/,https://chrdk.ru/news/obnaruzhen-novyi-dlya-rossii-vid-kleshchevogo-rikketsioza,26.11.2017,Обнаружен новый для России вид клещевого риккетсиоза,,,,Биология_Российская наука,Новости
chrdk.ru/news/news_obnaruzhen-novyi-vid-paukov-pritvoryayushchikhsya-listyami.txt,https://chrdk.ru/,https://chrdk.ru/news/obnaruzhen-novyi-vid-paukov-pritvoryayushchikhsya-listyami,21.11.2016,"Обнаружен новый вид пауков, притворяющихся листьями",,,,,Новости
chrdk.ru/news/news_obnaruzhen-sistema-ochistki-mozga-u-lyudei-i-primatov.txt,https://chrdk.ru/,https://chrdk.ru/news/obnaruzhen-sistema-ochistki-mozga-u-lyudei-i-primatov,05.10.2017,В мозге человека наконец обнаружили систему очистки,,,,Нейронауки_Биология,Новости
chrdk.ru/news/news_obnaruzhena-novaya-tushka-peshchernogo-lvenka.txt,https://chrdk.ru/,https://chrdk.ru/news/obnaruzhena-novaya-tushka-peshchernogo-lvenka,12.11.2017,Обнаружена новая сохранившаяся тушка пещерного львенка,,,,Палеонтология_Российская наука,Новости
chrdk.ru/news/news_obnaruzhennye_na_bolshoi_glubine_mikroby_pomogut_bezopasno_hranit_yadernye_othody.txt,https://chrdk.ru/,https://chrdk.ru/news/obnaruzhennye_na_bolshoi_glubine_mikroby_pomogut_bezopasno_hranit_yadernye_othody,17.10.2016,Подземные микробы помогут безопасно хранить ядерные отходы,,,,Науки о живом_Микробиология_Экология,Новости
chrdk.ru/news/news_obnaruzheno-12-genov-mutatcii-v-kotorykh-mogut-privodit-k-besplodiyu.txt,https://chrdk.ru/,https://chrdk.ru/news/obnaruzheno-12-genov-mutatcii-v-kotorykh-mogut-privodit-k-besplodiyu,07.11.2016,"Обнаружено 12 генов, мутации в которых могут приводить к бесплодию",,,,,Новости
chrdk.ru/news/news_obrazovanie-usilivaet-mnenie.txt,https://chrdk.ru/,https://chrdk.ru/news/obrazovanie-usilivaet-mnenie,22.08.2017,Для американцев с образованием убеждения важнее научных данных,,,,Социология,Новости
chrdk.ru/news/news_obrazovaniye-vidovi-na-primere-lyagushek.txt,https://chrdk.ru/,https://chrdk.ru/news/obrazovaniye-vidovi-na-primere-lyagushek,08.11.2017,Процесс образования новых видов изучили на примере съедобных лягушек,,,,Генетика_Животные,Новости
chrdk.ru/news/news_obshhiy_predok_sovremennyh_organizmov_zhil_v_gidrotermalnyh_istochnikah.txt,https://chrdk.ru/,https://chrdk.ru/news/obshhiy_predok_sovremennyh_organizmov_zhil_v_gidrotermalnyh_istochnikah,27.07.2016,Общий предок современных организмов жил в гидротермальных источниках,,,,Генетика_Палеонтология_Биология_Микробиология,Новости
chrdk.ru/news/news_obyavleny_laureaty_nobelevskoi_premii_po_himii_za_2016_god.txt,https://chrdk.ru/,https://chrdk.ru/news/obyavleny_laureaty_nobelevskoi_premii_po_himii_za_2016_god,05.10.2016,Объявлены лауреаты Нобелевской премии по химии за 2016 год,,,,Химия_Нобелевская премия,Новости
chrdk.ru/news/news_obyavleny_laureaty_premii_po_ekonomike_imeni_alfreda_nobelya.txt,https://chrdk.ru/,https://chrdk.ru/news/obyavleny_laureaty_premii_po_ekonomike_imeni_alfreda_nobelya,10.10.2016,Объявлены лауреаты премии по экономике имени Альфреда Нобеля,,,,Экономика_Нобелевская премия,Новости
chrdk.ru/news/news_ochistili-ot-virusov-dlya-peresadki.txt,https://chrdk.ru/,https://chrdk.ru/news/ochistili-ot-virusov-dlya-peresadki,10.08.2017,Геном свиней «очистили» от вирусов для пересадки их органов людям,,,,Генетика_Молекулярная биология,Новости
chrdk.ru/news/news_odinochestvo-ubivaet-samtcov-kosatok.txt,https://chrdk.ru/,https://chrdk.ru/news/odinochestvo-ubivaet-samtcov-kosatok,26.10.2017,Одиночество убивает самцов косаток,,,,Науки о живом_Животные,Новости
chrdk.ru/news/news_odinokie-raki-medlennee-pyaneyut.txt,https://chrdk.ru/,https://chrdk.ru/news/odinokie-raki-medlennee-pyaneyut,21.04.2017,Одинокие раки медленнее пьянеют,,,,Науки о живом,Новости
chrdk.ru/news/news_odni-i-te-zhe-izmeneniya-v-genakh-delayut-lyudei-i-sobak-sverkhdoverchivymi.txt,https://chrdk.ru/,https://chrdk.ru/news/odni-i-te-zhe-izmeneniya-v-genakh-delayut-lyudei-i-sobak-sverkhdoverchivymi,21.07.2017,Одни и те же изменения в генах делают людей и собак сверхдоверчивыми,,,,Генетика_Животные,Новости
chrdk.ru/news/news_odno-i-to-zhe-veshchestvo-otvechaet.txt,https://chrdk.ru/,https://chrdk.ru/news/odno-i-to-zhe-veshchestvo-otvechaet,02.10.2017,Одно и то же вещество отвечает за нарушения сна и проблемы с памятью,,,,Нейронауки_Биология,Новости
chrdk.ru/news/news_ogromnyi-genom-sdelal-chai-poleznym.txt,https://chrdk.ru/,https://chrdk.ru/news/ogromnyi-genom-sdelal-chai-poleznym,03.05.2017,Огромный геном сделал чай полезным,,,,Генетика_Молекулярная биология,Новости
chrdk.ru/news/news_okazavshis-sredi-chuzhikh-shimpanze-rozhayut-pozdnee.txt,https://chrdk.ru/,https://chrdk.ru/news/okazavshis-sredi-chuzhikh-shimpanze-rozhayut-pozdnee,22.11.2017,"Оказавшись среди чужих, шимпанзе рожают позднее",,,,Животные,Новости
chrdk.ru/news/news_okhotniki-mogut-delat-ptitc-umnee.txt,https://chrdk.ru/,https://chrdk.ru/news/okhotniki-mogut-delat-ptitc-umnee,03.11.2016,Охотники могут делать птиц умнее,,,,,Новости
chrdk.ru/news/news_oksitotcin-i-davlenie-gruppy-delayut-terpimee-k-bezhentcam.txt,https://chrdk.ru/,https://chrdk.ru/news/oksitotcin-i-davlenie-gruppy-delayut-terpimee-k-bezhentcam,14.08.2017,Окситоцин и давление группы делают терпимее к беженцам,,,,Социология_Биология,Новости
chrdk.ru/news/news_oksitotcin-zastavlyaet-myshei-radovatsya.txt,https://chrdk.ru/,https://chrdk.ru/news/oksitotcin-zastavlyaet-myshei-radovatsya,28.09.2017,Окситоцин заставляет мышей радоваться общению,,,,Нейронауки_Биология_Животные,Новости
chrdk.ru/news/news_oldest_australian_buildings.txt,https://chrdk.ru/,https://chrdk.ru/news/oldest_australian_buildings,06.09.2016,Археологи нашли самые древние дома Австралии,,,,Археология_Наука в университетах,Новости
chrdk.ru/news/news_oldest_indigo_fabric.txt,https://chrdk.ru/,https://chrdk.ru/news/oldest_indigo_fabric,16.09.2016,Антропологи нашли самую древнюю синюю ткань,,,,Химия_Археология_Антропология,Новости
chrdk.ru/news/news_oldest_in_solar_system.txt,https://chrdk.ru/,https://chrdk.ru/news/oldest_in_solar_system,13.06.2017,Ученые установили возраст самой старой планеты Солнечной системы,,,,Астрономия_Космос,Новости
chrdk.ru/news/news_olivkovoe-maslo-zashchishchaet-mozg.txt,https://chrdk.ru/,https://chrdk.ru/news/olivkovoe-maslo-zashchishchaet-mozg,23.06.2017,Оливковое масло защищает мозг от болезни Альцгеймера,,,,Нейронауки_Биология,Новости
chrdk.ru/news/news_onlain-igra-kak-lyudi-putayut-yazyki.txt,https://chrdk.ru/,https://chrdk.ru/news/onlain-igra-kak-lyudi-putayut-yazyki,05.04.2017,"Онлайн-игра помогла понять, как люди путают языки",,,,Лингвистика,Новости
chrdk.ru/news/news_onlain-kurs-o-gmo-ot-rossiiskikh-uchenykh-pobedil.txt,https://chrdk.ru/,https://chrdk.ru/news/onlain-kurs-o-gmo-ot-rossiiskikh-uchenykh-pobedil,19.11.2017,Онлайн-курс о ГМО от российских ученых победил на конкурсе EdCrunch Award,,,,Российская наука,Новости
chrdk.ru/news/news_opasnost-ischeznoveniya-torfyanykh-bolot.txt,https://chrdk.ru/,https://chrdk.ru/news/opasnost-ischeznoveniya-torfyanykh-bolot,24.11.2017,Биологи показали опасность исчезновения торфяных болот,,,,Биология_Российская наука_Экология,Новости
chrdk.ru/news/news_opasnyi_toksin_okazalsya_polezen_pri_bolezni_altsgeimera.txt,https://chrdk.ru/,https://chrdk.ru/news/opasnyi_toksin_okazalsya_polezen_pri_bolezni_altsgeimera,01.06.2016,Опасный токсин оказался полезен при болезни Альцгеймера,,,,Молекулярная биология_Биология_Медицина,Новости
chrdk.ru/news/news_opioids_affect_cuteness_of_babies.txt,https://chrdk.ru/,https://chrdk.ru/news/opioids_affect_cuteness_of_babies,20.09.2016,"Ученые выяснили, что опиатные наркоманы не умиляются младенцам",,,,Психология_Нейронауки_Медицина,Новости
chrdk.ru/news/news_opisan-mekhanizm-osyazaniya-u-bakterii.txt,https://chrdk.ru/,https://chrdk.ru/news/opisan-mekhanizm-osyazaniya-u-bakterii,30.10.2017,Описан механизм осязания у бактерий,,,,Биология_Микробиология,Новости
chrdk.ru/news/news_oplodotvorenie_v_probirke_stanovitsya_bezopasnee_s_vozrastom.txt,https://chrdk.ru/,https://chrdk.ru/news/oplodotvorenie_v_probirke_stanovitsya_bezopasnee_s_vozrastom,17.10.2016,Оплодотворение «в пробирке» становится безопаснее с возрастом,,,,Науки о живом_Биология_Медицина,Новости
chrdk.ru/news/news_optimalnyi-sposob-sostavleniya-setki-sportivnykh-turnirov.txt,https://chrdk.ru/,https://chrdk.ru/news/optimalnyi-sposob-sostavleniya-setki-sportivnykh-turnirov,26.11.2017,Математики нашли оптимальный способ составления сетки спортивных турниров,,,,Математика_Российская наука,Новости
chrdk.ru/news/news_ornitologi_dokazali_chto_ptitsy_mogut_spat_v_polete.txt,https://chrdk.ru/,https://chrdk.ru/news/ornitologi_dokazali_chto_ptitsy_mogut_spat_v_polete,05.08.2016,"Орнитологи доказали, что птицы могут спать в полете",,,,Науки о живом_Нейронауки_Животные,Новости
chrdk.ru/news/news_Orobanchaceae_horizontal_gene_transfer.txt,https://chrdk.ru/,https://chrdk.ru/news/Orobanchaceae_horizontal_gene_transfer,27.10.2016,"Ты то, что ты ешь: растения-паразиты используют гены хозяев",,,,Генетика_Наука в университетах_Растения,Новости
chrdk.ru/news/news_orthocarbonic_acid_on_uranus.txt,https://chrdk.ru/,https://chrdk.ru/news/orthocarbonic_acid_on_uranus,06.09.2016,Недра Нептуна и Урана могут содержать угольные кислоты,,,,Физика_Астрономия_Химия_Наука в университетах,Новости
chrdk.ru/news/news_oryx_is_back.txt,https://chrdk.ru/,https://chrdk.ru/news/oryx_is_back,19.01.2017,Саблерогий орикс возвращается домой,,,,,Новости
chrdk.ru/news/news_OSIRIS-REx_launch.txt,https://chrdk.ru/,https://chrdk.ru/news/OSIRIS-REx_launch,09.09.2016,OSIRIS-REx успешно стартовал к астероиду,,,,Космос,Новости
chrdk.ru/news/news_OSIRIS-REx_to_launch.txt,https://chrdk.ru/,https://chrdk.ru/news/OSIRIS-REx_to_launch,05.09.2016,К астероиду Бенну отправится аппарат за образцами грунта,,,,Геология_Космос,Новости
chrdk.ru/news/news_osminogi_i_drugie_golovonogie_razlichaut_tsveta_nesmotrya_na_monohromnoe_zrenie.txt,https://chrdk.ru/,https://chrdk.ru/news/osminogi_i_drugie_golovonogie_razlichaut_tsveta_nesmotrya_na_monohromnoe_zrenie,06.07.2016,"Осьминоги и другие головоногие различают цвета, несмотря на монохромное зрение",,,,Физика_Науки о живом_История_Биология_Животные,Новости
chrdk.ru/news/news_osteoartrit-metabolizm.txt,https://chrdk.ru/,https://chrdk.ru/news/osteoartrit-metabolizm,17.05.2017,Остеоартрит связан с плохим метаболизмом,,,,Биология,Новости
chrdk.ru/news/news_ostrovakh-vymershei-korovy.txt,https://chrdk.ru/,https://chrdk.ru/news/ostrovakh-vymershei-korovy,15.11.2017,На Командорских островах нашли останки вымершей морской коровы,,,,Российская наука,Новости
chrdk.ru/news/news_ot-lednika-v-antarktide-otkololsya-kusok-razmerom-chut-bolshe-omska.txt,https://chrdk.ru/,https://chrdk.ru/news/ot-lednika-v-antarktide-otkololsya-kusok-razmerom-chut-bolshe-omska,29.11.2016,От ледника в Антарктиде откололся кусок размером чуть больше Омска,,,,,Новости
chrdk.ru/news/news_otdelnye-organy-severnykh-ryb-nuzhno-proveryat-na-ddt.txt,https://chrdk.ru/,https://chrdk.ru/news/otdelnye-organy-severnykh-ryb-nuzhno-proveryat-na-ddt,11.11.2017,Отдельные органы северных рыб нужно проверять на ДДТ,,,,Биология_Российская наука_Экология,Новости
chrdk.ru/news/news_otkaz-ot-vyrashchivaniya-krs-snizit-parnikovyi-effekt.txt,https://chrdk.ru/,https://chrdk.ru/news/otkaz-ot-vyrashchivaniya-krs-snizit-parnikovyi-effekt,13.11.2017,Отказ США от выращивания рогатого скота снизит парниковый эффект,,,,Изменение климата_Экология,Новости
chrdk.ru/news/news_otkaz-ot-zavtrakov-povyshaet-risk-ateroskleroza.txt,https://chrdk.ru/,https://chrdk.ru/news/otkaz-ot-zavtrakov-povyshaet-risk-ateroskleroza,15.11.2017,Отказ от завтраков повышает риск атеросклероза,,,,,Новости
chrdk.ru/news/news_otkryt-novyi-vid-khishchnichestva.txt,https://chrdk.ru/,https://chrdk.ru/news/otkryt-novyi-vid-khishchnichestva,02.11.2017,Открыт новый вид хищничества,,,,Науки о живом,Новости
chrdk.ru/news/news_otkryto.txt,https://chrdk.ru/,https://chrdk.ru/news/otkryto,13.09.2016,Открыто!,,,,Анонс,Новости
chrdk.ru/news/news_ot_skiaparelli_net_vestei.txt,https://chrdk.ru/,https://chrdk.ru/news/ot_skiaparelli_net_vestei,19.10.2016,От «Скиапарелли» нет вестей,,,,Космос_Технологии,Новости
chrdk.ru/news/news_ovtcy-uznali-emmu-uotson.txt,https://chrdk.ru/,https://chrdk.ru/news/ovtcy-uznali-emmu-uotson,09.11.2017,Овцы узнали Эмму Уотсон на фотографиях,,,,Науки о живом_Животные,Новости
chrdk.ru/news/news_oxytocin_and_spirituality.txt,https://chrdk.ru/,https://chrdk.ru/news/oxytocin_and_spirituality,23.09.2016,Гормон окситоцин вызывает рост духовности,,,,Психология_Нейронауки_Медицина,Новости
chrdk.ru/news/news_ozonovaya_dyra_nad_antarktikoi_nachala_umenshatsya.txt,https://chrdk.ru/,https://chrdk.ru/news/ozonovaya_dyra_nad_antarktikoi_nachala_umenshatsya,04.07.2016,Озоновая дыра над Антарктикой начала уменьшаться,,,,Репортаж_Видео_География_Экология_Выбор редакции,Новости
chrdk.ru/news/news_paleontologi_issledovali_samyh_bolshih_dinozavrov_tsentralnoi_azii.txt,https://chrdk.ru/,https://chrdk.ru/news/paleontologi_issledovali_samyh_bolshih_dinozavrov_tsentralnoi_azii,05.10.2016,Палеонтологи исследовали самых больших динозавров Центральной Азии,,,,Палеонтология_Животные_Российская наука,Новости
chrdk.ru/news/news_paleontologi_otkryli_dva_novyh_vida_ihtiozavrov.txt,https://chrdk.ru/,https://chrdk.ru/news/paleontologi_otkryli_dva_novyh_vida_ihtiozavrov,06.10.2016,Палеонтологи открыли два новых вида ихтиозавров,,,,Палеонтология_Динозавры,Новости
chrdk.ru/news/news_paleontologi_vpervye_opisali_iskopaemye_tkani_mozga_nazemnogo_dinozavra.txt,https://chrdk.ru/,https://chrdk.ru/news/paleontologi_vpervye_opisali_iskopaemye_tkani_mozga_nazemnogo_dinozavra,28.10.2016,Палеонтологи впервые описали ископаемые ткани мозга наземного динозавра,,,,Науки о живом_Палеонтология,Новости
chrdk.ru/news/news_paleo_diet.txt,https://chrdk.ru/,https://chrdk.ru/news/paleo_diet,29.08.2016,"Палеодиета может быть полезна для сердца, выяснили ученые",,,,Медицина,Новости
chrdk.ru/news/news_pand-nado-zashishat.txt,https://chrdk.ru/,https://chrdk.ru/news/pand-nado-zashishat,25.09.2017,Понижение охранного статуса панд оказалось преждевременным,,,,Животные_Экология,Новости
chrdk.ru/news/news_parasite_manipulates_parasite.txt,https://chrdk.ru/,https://chrdk.ru/news/parasite_manipulates_parasite,26.01.2017,Паразит манипулирует паразитом,,,,Науки о живом_Животные,Новости
chrdk.ru/news/news_parkinsona-u-makak-vylechili.txt,https://chrdk.ru/,https://chrdk.ru/news/parkinsona-u-makak-vylechili,30.08.2017,Болезнь Паркинсона у макак вылечили с помощью стволовых клеток,,,,Нейронауки_Биология,Новости
chrdk.ru/news/news_parthenogenetic_zebra_shark.txt,https://chrdk.ru/,https://chrdk.ru/news/parthenogenetic_zebra_shark,18.01.2017,Акула продолжила род без помощи самца,,,,,Новости
chrdk.ru/news/news_pauki-mogut-byt-khoroshimi-ottcami.txt,https://chrdk.ru/,https://chrdk.ru/news/pauki-mogut-byt-khoroshimi-ottcami,07.12.2016,Пауки могут быть хорошими отцами,,,,,Новости
chrdk.ru/news/news_pauki_skakunchiki_sposoby_slyshat_otdalennye_zvuki_ne_imeya_ushei.txt,https://chrdk.ru/,https://chrdk.ru/news/pauki_skakunchiki_sposoby_slyshat_otdalennye_zvuki_ne_imeya_ushei,14.10.2016,"Пауки-скакунчики способы слышать отдаленные звуки, не имея ушей",,,,Науки о живом_Животные,Новости
chrdk.ru/news/news_peer_review_monument.txt,https://chrdk.ru/,https://chrdk.ru/news/peer_review_monument,13.09.2016,Социолог из ВШЭ предложил поставить в Москве памятник анонимному рецензенту,,,,Российская наука_Наука в университетах,Новости
chrdk.ru/news/news_pen-sniffing-cancer.txt,https://chrdk.ru/,https://chrdk.ru/news/pen-sniffing-cancer,07.09.2017,Эта ручка опознает раковую опухоль за 10 секунд,,,,Медицина_Технологии,Новости
chrdk.ru/news/news_pereiti-na-vozobnovlyaemye-istochniki-energii-vozmozhno-k-2050-godu.txt,https://chrdk.ru/,https://chrdk.ru/news/pereiti-na-vozobnovlyaemye-istochniki-energii-vozmozhno-k-2050-godu,23.08.2017,Для 139 стран написали план по переходу к «зеленой» энергетике к 2050 году,,,,Энергетика_Климат_Экология,Новости
chrdk.ru/news/news_perekhod-k-selskomu-khozyaistvu-povliyal-na-formu-cherepa.txt,https://chrdk.ru/,https://chrdk.ru/news/perekhod-k-selskomu-khozyaistvu-povliyal-na-formu-cherepa,24.07.2017,Переход к сельскому хозяйству повлиял на форму черепа людей,,,,,Новости
chrdk.ru/news/news_perekhodnoe-zveno-mezhdu-khishchnymi-i-travoyadnym.txt,https://chrdk.ru/,https://chrdk.ru/news/perekhodnoe-zveno-mezhdu-khishchnymi-i-travoyadnym,16.08.2017,Установлено переходное звено между хищными и травоядными динозаврами,,,,Палеонтология,Новости
chrdk.ru/news/news_perelomy-kostei-vylechat-pri-pomoshchi-nanochastitc.txt,https://chrdk.ru/,https://chrdk.ru/news/perelomy-kostei-vylechat-pri-pomoshchi-nanochastitc,15.11.2017,Переломы костей вылечат при помощи наночастиц,,,,Медицина,Новости
chrdk.ru/news/news_perestroiki-dnk-udalos-obyasnit-blagodarya-babochkam.txt,https://chrdk.ru/,https://chrdk.ru/news/perestroiki-dnk-udalos-obyasnit-blagodarya-babochkam,27.11.2017,Перестройки ДНК удалось объяснить благодаря бабочкам,,,,Генетика_Российская наука,Новости
chrdk.ru/news/news_permafrost_thawing_risks.txt,https://chrdk.ru/,https://chrdk.ru/news/permafrost_thawing_risks,15.02.2017,"Климатологи оценили, как таяние вечной мерзлоты скажется на России",,,,Климат_Российская наука_Экология,Новости
