path,source,url,date,title,subtitle,author,rubrics,tags,genre
chrdk.ru/news/news_-gigantskiy-pingvin.txt,https://chrdk.ru/,https://chrdk.ru/news/-gigantskiy-pingvin,28.02.2017,Древнейшие останки гигантского пингвина нашли в Новой Зеландии,,,,Палеонтология,Новости
chrdk.ru/news/news_14_iulya_proizoidet_soedinenie_luny_i_marsa.txt,https://chrdk.ru/,https://chrdk.ru/news/14_iulya_proizoidet_soedinenie_luny_i_marsa,14.07.2016,14 июля произойдет соединение Луны и Марса,,,,Астрономия_История,Новости
chrdk.ru/news/news_15-000-uchenykh-predupredili-ob-ekologicheskoi-katastrofe.txt,https://chrdk.ru/,https://chrdk.ru/news/15-000-uchenykh-predupredili-ob-ekologicheskoi-katastrofe,14.11.2017,15?000 ученых предупредили об экологической катастрофе,,,,Экология,Новости
chrdk.ru/news/news_150-minut-khodby-v-nedelyu-minimum.txt,https://chrdk.ru/,https://chrdk.ru/news/150-minut-khodby-v-nedelyu-minimum,24.10.2017,150 минут ходьбы в неделю — минимум для поддержания здоровья в старости,,,,Статистика,Новости
chrdk.ru/news/news_200-genov-oblyseniya.txt,https://chrdk.ru/,https://chrdk.ru/news/200-genov-oblyseniya,16.02.2017,"Найдено более 200 новых генов, связанных с облысением",,,,Генетика,Новости
chrdk.ru/news/news_2016-god-na-planete-okazalsya-rekordno-teplym.txt,https://chrdk.ru/,https://chrdk.ru/news/2016-god-na-planete-okazalsya-rekordno-teplym,09.08.2017,2016 год на планете оказался рекордно теплым,,,,Климат_Изменение климата,Новости
chrdk.ru/news/news_208-novykh-mineralov.txt,https://chrdk.ru/,https://chrdk.ru/news/208-novykh-mineralov,06.03.2017,Геологи предложили доказательство в пользу наступления эпохи антропоцена,,,,Геология,Новости
chrdk.ru/news/news_22-novykh-opornykh-vuza-rossii.txt,https://chrdk.ru/,https://chrdk.ru/news/22-novykh-opornykh-vuza-rossii,18.04.2017,Минобр назвал 22 новых опорных вуза России,,,,Образование,Новости
chrdk.ru/news/news_2809-gmstorm.txt,https://chrdk.ru/,https://chrdk.ru/news/2809-gmstorm,28.09.2017,Сильная магнитная буря обрушилась на Землю,,,,Астрономия,Новости
chrdk.ru/news/news_2D_magnet.txt,https://chrdk.ru/,https://chrdk.ru/news/2D_magnet,09.06.2017,Физики сделали двумерный магнит,,,,Физика_Материаловедение,Новости
chrdk.ru/news/news_3d-pechat-nashla-primenenie-v-fundamentalnoi-nauke.txt,https://chrdk.ru/,https://chrdk.ru/news/3d-pechat-nashla-primenenie-v-fundamentalnoi-nauke,28.04.2017,3D-печать нашла применение в фундаментальной науке,,,,Физика_Химия_Материаловедение,Новости
chrdk.ru/news/news_3d-printer-s-kvartcevym-steklom.txt,https://chrdk.ru/,https://chrdk.ru/news/3d-printer-s-kvartcevym-steklom,20.04.2017,Инженеры из Германии научились печатать кварцевым стеклом,,,,,Новости
chrdk.ru/news/news_3d-struktury-iz-nanozolota.txt,https://chrdk.ru/,https://chrdk.ru/news/3d-struktury-iz-nanozolota,10.10.2017,Бактерий научили собирать 3D-структуры из нанозолота,,,,Химия_Материаловедение_Биология,Новости
chrdk.ru/news/news_3radialene.txt,https://chrdk.ru/,https://chrdk.ru/news/3radialene,14.07.2016,Органическая электроника стала быстрее,,,,Физика_Химия_Материаловедение_Российская наука_Наука в университетах,Новости
chrdk.ru/news/news_57_codon_genome.txt,https://chrdk.ru/,https://chrdk.ru/news/57_codon_genome,22.08.2016,Биологи изменили геном кишечной палочки,,,,Генетика_Микробиология,Новости
chrdk.ru/news/news_800-tys-let-nazad.txt,https://chrdk.ru/,https://chrdk.ru/news/800-tys-let-nazad,12.10.2017,Гипотеза ученых о времени появления первых людей в Сибири подтвердилась,,,,Археология,Новости
chrdk.ru/news/news_82_percent_obesity.txt,https://chrdk.ru/,https://chrdk.ru/news/82_percent_obesity,09.11.2017,"В ДНК 82% россиян есть вариант «гена полноты», повышающий риск набора веса",,,,Российская наука_Медицина,Новости
chrdk.ru/news/news_akademiki_razoblachili_metod_testirovaniya_lichnosti_po_otpechatkam_paltsev.txt,https://chrdk.ru/,https://chrdk.ru/news/akademiki_razoblachili_metod_testirovaniya_lichnosti_po_otpechatkam_paltsev,19.05.2016,Академики разоблачили метод тестирования личности по отпечаткам пальцев,,,,Российская наука_Технологии,Новости
chrdk.ru/news/news_aktivnost-v-sotcsetyakh-svyazana-s-dolgoletiem.txt,https://chrdk.ru/,https://chrdk.ru/news/aktivnost-v-sotcsetyakh-svyazana-s-dolgoletiem,02.11.2016,Активность в соцсетях связана с долголетием,,,,,Новости
chrdk.ru/news/news_akuly_sposobny_vesti_sebya_v_gruppah_kak_vysshie_mlekopitaushhie.txt,https://chrdk.ru/,https://chrdk.ru/news/akuly_sposobny_vesti_sebya_v_gruppah_kak_vysshie_mlekopitaushhie,06.10.2016,Акулы способны вести себя в группах как высшие млекопитающие,,,,Науки о живом_Животные,Новости
chrdk.ru/news/news_alaid_cinder_cone.txt,https://chrdk.ru/,https://chrdk.ru/news/alaid_cinder_cone,26.04.2016,Курильский вулкан Алаид начал расти,,,,Геология_Российская наука_География,Новости
chrdk.ru/news/news_alkogol-portit.txt,https://chrdk.ru/,https://chrdk.ru/news/alkogol-portit,10.03.2017,Алкоголь портит систему поощрения,,,,Нейронауки_Биология,Новости
chrdk.ru/news/news_alternativnye-kremnievym-solnechnye-batarei-pokazali-rekordnoe-kpd.txt,https://chrdk.ru/,https://chrdk.ru/news/alternativnye-kremnievym-solnechnye-batarei-pokazali-rekordnoe-kpd,29.09.2017,Альтернативные кремниевые солнечные батареи показали рекордный КПД,,,,Материаловедение,Новости
chrdk.ru/news/news_altruizm-bez-napriaga.txt,https://chrdk.ru/,https://chrdk.ru/news/altruizm-bez-napriaga,03.07.2017,"Люди готовы помогать другим, если это не слишком трудозатратно",,,,Психология,Новости
chrdk.ru/news/news_amazonka-dvazhdy-zatoplyalas.txt,https://chrdk.ru/,https://chrdk.ru/news/amazonka-dvazhdy-zatoplyalas,04.05.2017,Амазонка дважды затоплялась морем,,,,Геология,Новости
chrdk.ru/news/news_amerikanskie_uchenye_zapustili_otkrytuu_observatoriu_sotsialnyh_media.txt,https://chrdk.ru/,https://chrdk.ru/news/amerikanskie_uchenye_zapustili_otkrytuu_observatoriu_sotsialnyh_media,06.05.2016,Американские ученые запустили открытую «Обсерваторию социальных медиа»,,,,Социология_Информационные технологии,Новости
chrdk.ru/news/news_ammonium_trichloroacetate.txt,https://chrdk.ru/,https://chrdk.ru/news/ammonium_trichloroacetate,06.05.2016,Физхимики МГУ разработали «экологичный» метод выделения РНК,,,,Науки о живом_Молекулярная биология_Биология_Российская наука_Наука в университетах_МГУ им. М.В. Ломоносова,Новости
chrdk.ru/news/news_amoralnye-ateisty.txt,https://chrdk.ru/,https://chrdk.ru/news/amoralnye-ateisty,07.08.2017,"Атеисты считают атеистов более аморальными, чем верующих",,,,Психология_Социология,Новости
chrdk.ru/news/news_analiticheskogo-myshleniya-nedostatochno.txt,https://chrdk.ru/,https://chrdk.ru/news/analiticheskogo-myshleniya-nedostatochno,20.11.2017,Для рационального взгляда на мир аналитического мышления недостаточно,,,,Психология_Социология,Новости
chrdk.ru/news/news_analiz-uchastka-gena-pomog-otkryt.txt,https://chrdk.ru/,https://chrdk.ru/news/analiz-uchastka-gena-pomog-otkryt,10.10.2017,Анализ участка гена помог открыть новый вид ящериц,,,,Науки о живом_Животные,Новости
chrdk.ru/news/news_ancient_timor_ornamentation.txt,https://chrdk.ru/,https://chrdk.ru/news/ancient_timor_ornamentation,19.08.2016,В Восточном Тиморе найдены древнейшие украшения Юго-Восточной Азии,,,,Археология_Наука в университетах,Новости
chrdk.ru/news/news_and-oskar-goes-tooo.txt,https://chrdk.ru/,https://chrdk.ru/news/and-oskar-goes-tooo,07.02.2017,«Оскары» чаще выигрывают американские актеры в фильмах об американской культуре,,,,Психология_Социология,Новости
chrdk.ru/news/news_anomalnoe-poteplenie-snizhaet-urozhai.txt,https://chrdk.ru/,https://chrdk.ru/news/anomalnoe-poteplenie-snizhaet-urozhai,11.07.2017,Аномальное потепление в Арктике снижает урожаи в Северной Америке,,,,Климат_Изменение климата_Экология,Новости
chrdk.ru/news/news_Antarctic_Bacteria_Skoltech.txt,https://chrdk.ru/,https://chrdk.ru/news/Antarctic_Bacteria_Skoltech,28.04.2016,"Биологи показали, что бактерии попадают в Антарктиду с других континентов",,,,Молекулярная биология_Российская наука_Наука в университетах_Микробиология_Экология,Новости
chrdk.ru/news/news_antibakterialnye-veshchestva-peredayutsya-potomstvu.txt,https://chrdk.ru/,https://chrdk.ru/news/antibakterialnye-veshchestva-peredayutsya-potomstvu,10.08.2017,Антибактериальное мыло вредит потомству в организме матери,,,,Химия_Биология,Новости
chrdk.ru/news/news_antibiotik-protiv-ustoichivykh-bakterii.txt,https://chrdk.ru/,https://chrdk.ru/news/antibiotik-protiv-ustoichivykh-bakterii,11.05.2017,Ученые создали эффективный антибиотик против устойчивых бактерий,,,,Микробиология,Новости
chrdk.ru/news/news_antibiotiki-vredyat-pchelam.txt,https://chrdk.ru/,https://chrdk.ru/news/antibiotiki-vredyat-pchelam,16.03.2017,"Антибиотики вредят пчелам так же, как и людям",,,,Биология_Животные_Микробиология,Новости
chrdk.ru/news/news_Antikythera_inscriptions.txt,https://chrdk.ru/,https://chrdk.ru/news/Antikythera_inscriptions,14.06.2016,Ученые расшифровали надписи на древнем астрономическом приборе,,,,Археология_История_Репортаж_Видео_Выбор редакции,Новости
chrdk.ru/news/news_antioksidanty-snizhayut-risk-diabeta.txt,https://chrdk.ru/,https://chrdk.ru/news/antioksidanty-snizhayut-risk-diabeta,10.11.2017,Антиоксиданты снижают риск возникновения диабета,,,,Биология_Медицина,Новости
chrdk.ru/news/news_antropologi_predpolozhili_kogda_i_pochemu_ludi_priruchili_ogon.txt,https://chrdk.ru/,https://chrdk.ru/news/antropologi_predpolozhili_kogda_i_pochemu_ludi_priruchili_ogon,13.04.2016,"Антропологи объяснили, как люди «приручили» огонь",,,,Науки о живом_Палеонтология_Климат_Антропология,Новости
chrdk.ru/news/news_ants_underground.txt,https://chrdk.ru/,https://chrdk.ru/news/ants_underground,06.09.2016,Муравьи провалились под землю и построили там муравейник,,,,Биология_Животные,Новости
chrdk.ru/news/news_apostasia-sdala-vseh.txt,https://chrdk.ru/,https://chrdk.ru/news/apostasia-sdala-vseh,13.09.2017,Секвенирование генома апостасии прояснило эволюцию всех орхидных,,,,Генетика_Ботаника_Эволюционная биология,Новости
chrdk.ru/news/news_apparat_rozetta_upal_na_kometu_zavershiv_12_letnuu_missiu.txt,https://chrdk.ru/,https://chrdk.ru/news/apparat_rozetta_upal_na_kometu_zavershiv_12_letnuu_missiu,30.09.2016,"Аппарат «Розетта» упал на комету, завершив 12-летнюю миссию",,,,Космос_Технологии_Выбор редакции,Новости
chrdk.ru/news/news_applauding_lobopodian.txt,https://chrdk.ru/,https://chrdk.ru/news/applauding_lobopodian,31.01.2017,Древний родственник тихоходок «аплодировал» в поисках еды,,,,Палеонтология_Животные,Новости
chrdk.ru/news/news_arabidopsis_atlas.txt,https://chrdk.ru/,https://chrdk.ru/news/arabidopsis_atlas,08.09.2016,Биологи создали атлас экспрессии генов резуховидки,,,,Генетика_Биология_Российская наука_Наука в университетах_Растения,Новости
chrdk.ru/news/news_Arachnocampa_glue.txt,https://chrdk.ru/,https://chrdk.ru/news/Arachnocampa_glue,15.12.2016,Новозеландские энтомологи изучили ловчую слизь хищных личинок,,,,Науки о живом_Животные,Новости
chrdk.ru/news/news_archean_ocean_temperature.txt,https://chrdk.ru/,https://chrdk.ru/news/archean_ocean_temperature,06.06.2017,Температуру древних океанов замерили «белковым термометром»,,,,Молекулярная биология_Климат,Новости
chrdk.ru/news/news_arctic_toothy_bird.txt,https://chrdk.ru/,https://chrdk.ru/news/arctic_toothy_bird,31.12.2016,Арктические зубастые птицы жили в тепле,,,,Палеонтология_Животные_Климат,Новости
chrdk.ru/news/news_arheologi_mgu_izuchili_stoyanku_drevnego_cheloveka_pod_vladimirom.txt,https://chrdk.ru/,https://chrdk.ru/news/arheologi_mgu_izuchili_stoyanku_drevnego_cheloveka_pod_vladimirom,14.04.2016,Археологи МГУ изучили стоянку древнего человека под Владимиром,,,,Археология_История_Российская наука_Наука в университетах_МГУ им. М.В. Ломоносова,Новости
chrdk.ru/news/news_arkheologi-nashli-gorod-vremen-akkadskoi-imperii-ryadom-s-islamskim-gosudarstvom.txt,https://chrdk.ru/,https://chrdk.ru/news/arkheologi-nashli-gorod-vremen-akkadskoi-imperii-ryadom-s-islamskim-gosudarstvom,08.11.2016,Археологи нашли город времен Аккадской империи рядом с «Исламским государством»,,,,,Новости
chrdk.ru/news/news_arkheologi-nashli-prichinu-poyavleniya-neravenstva-v-obshchestve-neolita.txt,https://chrdk.ru/,https://chrdk.ru/news/arkheologi-nashli-prichinu-poyavleniya-neravenstva-v-obshchestve-neolita,17.11.2017,Археологи нашли причину появления неравенства в обществе неолита,,,,Археология_Социология,Новости
chrdk.ru/news/news_arkheologi-omolodili-ryad-nakhodok-iz-altaya.txt,https://chrdk.ru/,https://chrdk.ru/news/arkheologi-omolodili-ryad-nakhodok-iz-altaya,13.11.2017,Археологи «омолодили» ряд находок из Алтая и Евразийских степей,,,,Археология_Российская наука,Новости
chrdk.ru/news/news_arkheologi-rekonstruirovali-byt-rabochikh-kopei-tcarya-solomona.txt,https://chrdk.ru/,https://chrdk.ru/news/arkheologi-rekonstruirovali-byt-rabochikh-kopei-tcarya-solomona,20.01.2017,Археологи реконструировали быт рабочих «Копей царя Соломона»,,,,Археология,Новости
chrdk.ru/news/news_arkticheskiy_detektor_poka_ne_obnaruzhil_sterilnoe_neitrino.txt,https://chrdk.ru/,https://chrdk.ru/news/arkticheskiy_detektor_poka_ne_obnaruzhil_sterilnoe_neitrino,10.08.2016,Антарктический детектор пока не обнаружил стерильное нейтрино,,,,Физика,Новости
chrdk.ru/news/news_arktika-okazalas-svalkoi-musora.txt,https://chrdk.ru/,https://chrdk.ru/news/arktika-okazalas-svalkoi-musora,20.04.2017,Арктика оказалась «свалкой» пластикового мусора из Атлантики,,,,Экология,Новости
chrdk.ru/news/news_ars_electronika.txt,https://chrdk.ru/,https://chrdk.ru/news/ars_electronika,07.06.2016,Лаборатория Земля. Политех,,,,История_Космос_Музей,Новости
chrdk.ru/news/news_artemisia_vs_tuberculosis.txt,https://chrdk.ru/,https://chrdk.ru/news/artemisia_vs_tuberculosis,28.12.2016,Полынь поможет бороться с туберкулезом,,,,Молекулярная биология_Медицина_Микробиология,Новости
chrdk.ru/news/news_artrit-u-zhitelei-azii-svyazan-s-rostom.txt,https://chrdk.ru/,https://chrdk.ru/news/artrit-u-zhitelei-azii-svyazan-s-rostom,05.07.2017,Частый артрит у жителей Азии связан с низким ростом,,,,Генетика,Новости
chrdk.ru/news/news_asgardian_sat.txt,https://chrdk.ru/,https://chrdk.ru/news/asgardian_sat,08.06.2017,Самопровозглашенное государство запустит на орбиту хранилище данных,,,,Космос_Технологии,Новости
chrdk.ru/news/news_asgard_archaea.txt,https://chrdk.ru/,https://chrdk.ru/news/asgard_archaea,17.01.2017,Эукариоты вышли из Асгарда,,,,,Новости
chrdk.ru/news/news_asteroid_ubivshiy_dinozavrov_unichtozhil_93_mlekopitaushhih.txt,https://chrdk.ru/,https://chrdk.ru/news/asteroid_ubivshiy_dinozavrov_unichtozhil_93_mlekopitaushhih,20.06.2016,"Астероид, убивший динозавров, уничтожил 93% млекопитающих",,,,Науки о живом_Палеонтология_Животные_Динозавры,Новости
chrdk.ru/news/news_astrofiziki_budut_issledovat_zarodyshi_chernyh_dyr_po_gravitatsionnym_volnam.txt,https://chrdk.ru/,https://chrdk.ru/news/astrofiziki_budut_issledovat_zarodyshi_chernyh_dyr_po_gravitatsionnym_volnam,27.06.2016,Астрофизики будут исследовать «зародыши» черных дыр по гравитационным волнам,,,,Физика_Астрономия_Космос,Новости
chrdk.ru/news/news_astrofiziki_pridumali_kak_tochno_izmerit_gravitatsionnuu_postoyannuu_iz_kosmosa.txt,https://chrdk.ru/,https://chrdk.ru/news/astrofiziki_pridumali_kak_tochno_izmerit_gravitatsionnuu_postoyannuu_iz_kosmosa,18.05.2016,"Астрофизики придумали, как точно измерить гравитационную постоянную из космоса",,,,Физика_Астрономия_Космос,Новости
chrdk.ru/news/news_astronomy-opisali-izluchenie-chernoi-dyry-s-vualyu.txt,https://chrdk.ru/,https://chrdk.ru/news/astronomy-opisali-izluchenie-chernoi-dyry-s-vualyu,22.11.2017,Астрономы описали излучение черной дыры с «вуалью»,,,,Астрономия_Российская наука,Новости
chrdk.ru/news/news_astronomy-poimali-koriolisa.txt,https://chrdk.ru/,https://chrdk.ru/news/astronomy-poimali-koriolisa,28.03.2017,Астрономы «поймали» на Солнце силу Кориолиса,,,,Физика_Астрономия,Новости
chrdk.ru/news/news_astronomy_sfotografirovali_zvezdu_gipergigant_etu_kilya_v_maksimalnom_razreshenii.txt,https://chrdk.ru/,https://chrdk.ru/news/astronomy_sfotografirovali_zvezdu_gipergigant_etu_kilya_v_maksimalnom_razreshenii,20.10.2016,Звезду-гипергигант Эту Киля сфотографировали в максимальном разрешении,,,,Физика_Астрономия_Космос,Новости
chrdk.ru/news/news_atcteki-i-salmonella.txt,https://chrdk.ru/,https://chrdk.ru/news/atcteki-i-salmonella,20.02.2017,Цивилизацию ацтеков могла погубить бактерия сальмонеллы,,,,История_Биология_Микробиология_Антропология,Новости
chrdk.ru/news/news_ateroskleroz-mozhno-predskazat-bez-analizov.txt,https://chrdk.ru/,https://chrdk.ru/news/ateroskleroz-mozhno-predskazat-bez-analizov,14.11.2017,Риск атеросклероза можно предсказать без сдачи анализов,,,,Медицина,Новости
chrdk.ru/news/news_australian_venomous_injuries.txt,https://chrdk.ru/,https://chrdk.ru/news/australian_venomous_injuries,18.01.2017,"Пчелы и осы опаснее для австралийцев, чем змеи и пауки",,,,Биология_Животные,Новости
chrdk.ru/news/news_avialainer-ms-21-vpervye-ispytali-s-rossiiskimi-dvigatelyami.txt,https://chrdk.ru/,https://chrdk.ru/news/avialainer-ms-21-vpervye-ispytali-s-rossiiskimi-dvigatelyami,15.11.2017,Авиалайнер МС-21 впервые испытали с российскими двигателями,,,,Российская наука_Технологии,Новости
chrdk.ru/news/news_avstraliiskie-aborigeny-na-odnom-meste.txt,https://chrdk.ru/,https://chrdk.ru/news/avstraliiskie-aborigeny-na-odnom-meste,10.03.2017,Австралийские аборигены долго живут на одном месте,,,,Генетика_Палеонтология,Новости
chrdk.ru/news/news_avstraliyskie_paleontologi_obnaruzhili_ostanki_mikrolva.txt,https://chrdk.ru/,https://chrdk.ru/news/avstraliyskie_paleontologi_obnaruzhili_ostanki_mikrolva,26.08.2016,Австралийские палеонтологи обнаружили останки «микрольва»,,,,Палеонтология_Животные,Новости
chrdk.ru/news/news_avstraliyskie_uchenye_gotovy_postroit_dom_s_nuevym_potrebleniem_elektroenergii.txt,https://chrdk.ru/,https://chrdk.ru/news/avstraliyskie_uchenye_gotovy_postroit_dom_s_nuevym_potrebleniem_elektroenergii,01.05.2016,Австралийские ученые приблизились к созданию энергонезависимого дома,,,,Физика_Химия_Энергетика,Новости
chrdk.ru/news/news_avtopilot-tam-zhe-gde-grezy-nayavu.txt,https://chrdk.ru/,https://chrdk.ru/news/avtopilot-tam-zhe-gde-grezy-nayavu,15.11.2017,"«Автопилот» мозга находится там же, где «грезы наяву»",,,,Нейронауки,Новости
chrdk.ru/news/news_bacterial_aphrodisiac.txt,https://chrdk.ru/,https://chrdk.ru/news/bacterial_aphrodisiac,09.06.2017,Бактерии заставили размножаться одноклеточных жгутиконосцев,,,,Молекулярная биология,Новости
chrdk.ru/news/news_baculum_and_polygamy.txt,https://chrdk.ru/,https://chrdk.ru/news/baculum_and_polygamy,14.12.2016,Полигамия помогла сохранить кость в пенисе,,,,,Новости
chrdk.ru/news/news_bad-teeth-are-your-fault.txt,https://chrdk.ru/,https://chrdk.ru/news/bad-teeth-are-your-fault,13.09.2017,"Здоровье зубов зависит больше от гигиены, чем от наследственности",,,,Медицина_Микробиология,Новости
chrdk.ru/news/news_bad_mood_contagiousness.txt,https://chrdk.ru/,https://chrdk.ru/news/bad_mood_contagiousness,21.09.2017,Плохое настроение недостаточно заразно,,,,Психология_Социология,Новости
chrdk.ru/news/news_bakterii-diktuyut-mukham.txt,https://chrdk.ru/,https://chrdk.ru/news/bakterii-diktuyut-mukham,26.04.2017,"Бактерии диктуют мухам, что есть и как размножаться",,,,Науки о живом_Биология,Новости
chrdk.ru/news/news_bakterii-menyayut-povedenie.txt,https://chrdk.ru/,https://chrdk.ru/news/bakterii-menyayut-povedenie,18.04.2017,"Бактерии меняют поведение, почуяв грибы",,,,Науки о живом_Химия_Биология,Новости
chrdk.ru/news/news_bakterii-shchupayut-nas-iznutri.txt,https://chrdk.ru/,https://chrdk.ru/news/bakterii-shchupayut-nas-iznutri,16.08.2017,Бактерии щупают нас изнутри,,,,Микробиология,Новости
